"","text","favorited","favoriteCount","replyToSN","created","truncated","replyToSID","id","replyToUID","statusSource","screenName","retweetCount","isRetweet","retweeted","longitude","latitude"
"1","Dukun Muda Pengganda Uang juga Jadi Langganan Pemandu Karaoke http://t.co/teUCxweNWH",FALSE,0,NA,2015-04-02 17:16:24,FALSE,NA,"583679386945093633",NA,"<a href=""http://my.kompas.com"" rel=""nofollow"">MyKompas</a>","kompascom",1,FALSE,FALSE,NA,NA
"2","Kawanan Maling Gasak Komputer dan Ponsel di Gerai Samsung Service http://t.co/MjGvGx01uS",FALSE,1,NA,2015-04-02 16:56:22,FALSE,NA,"583674346041839617",NA,"<a href=""http://my.kompas.com"" rel=""nofollow"">MyKompas</a>","kompascom",3,FALSE,FALSE,NA,NA
"3","Kenangan Dian Pelangi Main Sepak Bola http://t.co/fODmXm1D3N",FALSE,0,NA,2015-04-02 16:56:12,FALSE,NA,"583674301984800769",NA,"<a href=""http://my.kompas.com"" rel=""nofollow"">MyKompas</a>","kompascom",1,FALSE,FALSE,NA,NA
"4","Sean Gelael Siap Beraksi di Formula Renault 3.5 http://t.co/mRJm9LwULW",FALSE,2,NA,2015-04-02 16:31:59,FALSE,NA,"583668208722321409",NA,"<a href=""http://my.kompas.com"" rel=""nofollow"">MyKompas</a>","kompascom",0,FALSE,FALSE,NA,NA
"5","Ditemukan Kotak Hitam Kedua Germanwings http://t.co/F9sOh9Cdrp",FALSE,2,NA,2015-04-02 16:29:58,FALSE,NA,"583667700087398400",NA,"<a href=""http://my.kompas.com"" rel=""nofollow"">MyKompas</a>","kompascom",2,FALSE,FALSE,NA,NA
"6","Atep Sedih soal Kasus Korupsi Stadion Gelora Bandung Lautan Api http://t.co/LcQfP7FweD",FALSE,3,NA,2015-04-02 16:28:02,FALSE,NA,"583667215548882947",NA,"<a href=""http://my.kompas.com"" rel=""nofollow"">MyKompas</a>","kompascom",10,FALSE,FALSE,NA,NA
"7","BPS: Kenaikan Harga Elpiji 12 Kg Tak Banyak Berpengaruh pada Inflasi April http://t.co/Y9lkArdBA8",FALSE,5,NA,2015-04-02 16:23:59,FALSE,NA,"583666195808694272",NA,"<a href=""http://my.kompas.com"" rel=""nofollow"">MyKompas</a>","kompascom",3,FALSE,FALSE,NA,NA
"8","Harry Kane Akan Tampil di Piala Eropa U-21 http://t.co/UgrTveh8tT",FALSE,3,NA,2015-04-02 16:19:53,FALSE,NA,"583665161254240256",NA,"<a href=""http://my.kompas.com"" rel=""nofollow"">MyKompas</a>","kompascom",4,FALSE,FALSE,NA,NA
"9","2 Remaja diperkosa di Badaun India http://t.co/XLZapcK8NM",FALSE,3,NA,2015-04-02 16:09:48,FALSE,NA,"583662625902366720",NA,"<a href=""http://my.kompas.com"" rel=""nofollow"">MyKompas</a>","kompascom",2,FALSE,FALSE,NA,NA
"10","Ditanya soal Saran KPK Terhadap Sistem ""Payment Gateway"", Ini Jawaban Denny Indrayana http://t.co/8ozxK3xIeB",FALSE,0,NA,2015-04-02 16:03:57,FALSE,NA,"583661154183938048",NA,"<a href=""http://my.kompas.com"" rel=""nofollow"">MyKompas</a>","kompascom",3,FALSE,FALSE,NA,NA
"11","Ribery Absen Kontra Dortmund http://t.co/Wmlk3x22EO",FALSE,0,NA,2015-04-02 16:03:47,FALSE,NA,"583661110244454401",NA,"<a href=""http://my.kompas.com"" rel=""nofollow"">MyKompas</a>","kompascom",6,FALSE,FALSE,NA,NA
"12","Benarkah Ini Foto Penghormatan Terakhir Dokter kepada Olga Syahputra? http://t.co/KAAXjyxLZj",FALSE,17,NA,2015-04-02 15:55:41,FALSE,NA,"583659074253783040",NA,"<a href=""http://my.kompas.com"" rel=""nofollow"">MyKompas</a>","kompascom",10,FALSE,FALSE,NA,NA
"13","Dapat Komentar dari Akademisi IPB, Ini Tanggapan Susi http://t.co/bAXQIWhLfj",FALSE,1,NA,2015-04-02 15:51:38,FALSE,NA,"583658053456625664",NA,"<a href=""http://my.kompas.com"" rel=""nofollow"">MyKompas</a>","kompascom",6,FALSE,FALSE,NA,NA
"14","Rodgers: Liverpool Lebih Besar daripada Arsenal, Sterling! http://t.co/cHZZ0ieOjZ",FALSE,2,NA,2015-04-02 15:49:37,FALSE,NA,"583657544217788416",NA,"<a href=""http://my.kompas.com"" rel=""nofollow"">MyKompas</a>","kompascom",11,FALSE,FALSE,NA,NA
"15","Produk Palsu Marak, Warga Harus Ikut Awasi http://t.co/hjZVVzZVeE",FALSE,2,NA,2015-04-02 15:35:43,FALSE,NA,"583654046742904832",NA,"<a href=""http://my.kompas.com"" rel=""nofollow"">MyKompas</a>","kompascom",6,FALSE,FALSE,NA,NA
"16","Terima Surat Rekomendasi BOPI, Persib Siap Jamu Semen Padang http://t.co/7JN1Wp3lnE",FALSE,1,NA,2015-04-02 15:35:32,FALSE,NA,"583654002480422912",NA,"<a href=""http://my.kompas.com"" rel=""nofollow"">MyKompas</a>","kompascom",5,FALSE,FALSE,NA,NA
"17","Pelatih Semen Padang Bicara soal Spaso http://t.co/2ragyN6Juy",FALSE,2,NA,2015-04-02 15:17:21,FALSE,NA,"583649424422801408",NA,"<a href=""http://my.kompas.com"" rel=""nofollow"">MyKompas</a>","kompascom",8,FALSE,FALSE,NA,NA
"18","Tony Fernandes Siapkan IPO Indonesia AirAsia http://t.co/gLbnQeCpCj.",FALSE,5,NA,2015-04-02 15:09:20,FALSE,NA,"583647410108280833",NA,"<a href=""http://my.kompas.com"" rel=""nofollow"">MyKompas</a>","kompascom",8,FALSE,FALSE,NA,NA
"19","Tetap Pegang Kendali Partai, Agung Laksono Tak Ingin Ada Kevakuman di Golkar http://t.co/tLNoaCCLO5",FALSE,5,NA,2015-04-02 15:07:17,FALSE,NA,"583646892128538625",NA,"<a href=""http://my.kompas.com"" rel=""nofollow"">MyKompas</a>","kompascom",5,FALSE,FALSE,NA,NA
"20","Dicecar 34 Pertanyaan Selama 8 Jam, Denny Keluar Bareskrim Sambil Tersenyum http://t.co/JEB250mcsc",FALSE,5,NA,2015-04-02 15:03:15,FALSE,NA,"583645879539642368",NA,"<a href=""http://my.kompas.com"" rel=""nofollow"">MyKompas</a>","kompascom",8,FALSE,FALSE,NA,NA
"21","Amankan Paskah, Polda NTT Siapkan 1.025 Personel http://t.co/i8BDjBtt2t",FALSE,3,NA,2015-04-02 14:55:23,FALSE,NA,"583643897814847488",NA,"<a href=""http://my.kompas.com"" rel=""nofollow"">MyKompas</a>","kompascom",4,FALSE,FALSE,NA,NA
"22","Bali Kaji Penerbangan Langsung ke Yunnan dan Hainan http://t.co/6LUrmBNqMz",FALSE,4,NA,2015-04-02 14:55:12,FALSE,NA,"583643852994584577",NA,"<a href=""http://my.kompas.com"" rel=""nofollow"">MyKompas</a>","kompascom",1,FALSE,FALSE,NA,NA
"23","KPK Sebut BPKP Belum Selesai Hitung Kerugian Negara dalam Kasus Suryadharma Ali http://t.co/63ROvFPNr4",FALSE,5,NA,2015-04-02 14:51:08,FALSE,NA,"583642830192582657",NA,"<a href=""http://my.kompas.com"" rel=""nofollow"">MyKompas</a>","kompascom",7,FALSE,FALSE,NA,NA
"24","Banyak Anggaran DKI Dikoreksi Kemendagri, Ini Kata Ahok  http://t.co/Cro9wDbNie",FALSE,2,NA,2015-04-02 14:43:04,FALSE,NA,"583640798803009537",NA,"<a href=""http://my.kompas.com"" rel=""nofollow"">MyKompas</a>","kompascom",9,FALSE,FALSE,NA,NA
"25","Temui Gubernur Maluku, Warga Adat Minta Gunung Botak Tidak Ditutup  http://t.co/DibvjVEtod",FALSE,1,NA,2015-04-02 14:41:02,FALSE,NA,"583640288704368640",NA,"<a href=""http://my.kompas.com"" rel=""nofollow"">MyKompas</a>","kompascom",3,FALSE,FALSE,NA,NA
"26","Lawan Arus, Pengendara Ini Cuek Halangi Mobil di Depannya http://t.co/4rHmreYCGf",FALSE,7,NA,2015-04-02 14:39:02,FALSE,NA,"583639782942576642",NA,"<a href=""http://my.kompas.com"" rel=""nofollow"">MyKompas</a>","kompascom",7,FALSE,FALSE,NA,NA
"27","""Mourinho Pasti Kembali ke Madrid"" http://t.co/Eb82YCuVv1.",FALSE,8,NA,2015-04-02 14:35:00,FALSE,NA,"583638766830522369",NA,"<a href=""http://my.kompas.com"" rel=""nofollow"">MyKompas</a>","kompascom",9,FALSE,FALSE,NA,NA
"28","Wapres: Kerugiannya Lebih Besar jika Cilamaya Dilanjutkan http://t.co/NsZ5yLmt64",FALSE,6,NA,2015-04-02 14:29:10,FALSE,NA,"583637302187962369",NA,"<a href=""http://my.kompas.com"" rel=""nofollow"">MyKompas</a>","kompascom",2,FALSE,FALSE,NA,NA
"29","Shae: Konser Tunggal Bisa di Terminal Bus http://t.co/c2Jbxzi2RR",FALSE,3,NA,2015-04-02 14:29:00,FALSE,NA,"583637257967407104",NA,"<a href=""http://my.kompas.com"" rel=""nofollow"">MyKompas</a>","kompascom",2,FALSE,FALSE,NA,NA
"30","Ulama Bandung Minta Terduga ISIS Dibina, Bukan Diusir http://t.co/ajo2RfEw5K",FALSE,10,NA,2015-04-02 14:26:57,FALSE,NA,"583636744144203777",NA,"<a href=""http://my.kompas.com"" rel=""nofollow"">MyKompas</a>","kompascom",7,FALSE,FALSE,NA,NA
"31","FBI Umumkan Kematian Pimpinan Jemaah Islamiyah http://t.co/MKqOMeicpH",FALSE,8,NA,2015-04-02 14:22:56,FALSE,NA,"583635731702157312",NA,"<a href=""http://my.kompas.com"" rel=""nofollow"">MyKompas</a>","kompascom",5,FALSE,FALSE,NA,NA
"32","Malaysia Deportasi 127 TKI Ilegal melalui Nunukan. http://t.co/prApu1uz7Y",FALSE,4,NA,2015-04-02 14:14:50,FALSE,NA,"583633693643710465",NA,"<a href=""http://my.kompas.com"" rel=""nofollow"">MyKompas</a>","kompascom",3,FALSE,FALSE,NA,NA
"33","Pemuda 17 Tahun Ingin Ledakkan Camp Nou http://t.co/Qon0bPHHDl",FALSE,5,NA,2015-04-02 14:08:47,FALSE,NA,"583632170696089600",NA,"<a href=""http://my.kompas.com"" rel=""nofollow"">MyKompas</a>","kompascom",13,FALSE,FALSE,NA,NA
"34","Ada yang Dirindukan Marshanda http://t.co/nV3dbxnY3Z",FALSE,6,NA,2015-04-02 14:06:43,FALSE,NA,"583631649599950848",NA,"<a href=""http://my.kompas.com"" rel=""nofollow"">MyKompas</a>","kompascom",1,FALSE,FALSE,NA,NA
"35","Lebih dari 25.000 Petarung ISIS Datang dari 100 Negara http://t.co/tQeaV6EYcr",FALSE,5,NA,2015-04-02 14:05:10,FALSE,NA,"583631258745319426",NA,"<a href=""http://my.kompas.com"" rel=""nofollow"">MyKompas</a>","kompascom",7,FALSE,FALSE,NA,NA
"36","Kejutan dari Pemain Kidal http://t.co/2YmG6xCKof",FALSE,2,NA,2015-04-02 14:04:59,FALSE,NA,"583631214289952768",NA,"<a href=""http://my.kompas.com"" rel=""nofollow"">MyKompas</a>","kompascom",3,FALSE,FALSE,NA,NA
"37","Bupati Bandung: Kalau Mau Gabung ISIS Silakan, Malah ""Ngurangin"" Warga http://t.co/iMH35hnPIV",FALSE,3,NA,2015-04-02 14:04:48,FALSE,NA,"583631169767350272",NA,"<a href=""http://my.kompas.com"" rel=""nofollow"">MyKompas</a>","kompascom",19,FALSE,FALSE,NA,NA
"38","NTB Sering Mati Listrik, Ombudsman Datangi PLN  http://t.co/FaesCKylTi",FALSE,5,NA,2015-04-02 13:44:34,FALSE,NA,"583626078285012993",NA,"<a href=""http://my.kompas.com"" rel=""nofollow"">MyKompas</a>","kompascom",11,FALSE,FALSE,NA,NA
"39","Agung Laksono: Pimpinan DPR Seharusnya Tak Jadi ""Trouble Maker"" http://t.co/5HxJ5tlOUw",FALSE,8,NA,2015-04-02 13:42:34,FALSE,NA,"583625571457863681",NA,"<a href=""http://my.kompas.com"" rel=""nofollow"">MyKompas</a>","kompascom",11,FALSE,FALSE,NA,NA
"40","Kemendagri Sarankan Ahok Terapkan ""Nawacita"" Jokowi dalam Susun Anggaran http://t.co/nIOlUyRmTr",FALSE,6,NA,2015-04-02 13:28:38,FALSE,NA,"583622067418898434",NA,"<a href=""http://my.kompas.com"" rel=""nofollow"">MyKompas</a>","kompascom",5,FALSE,FALSE,NA,NA
"41","Nitya/Greysia Hadapi Ganda Tiongkok http://t.co/dYjgSh7Liz",FALSE,2,NA,2015-04-02 13:28:28,FALSE,NA,"583622023550607361",NA,"<a href=""http://my.kompas.com"" rel=""nofollow"">MyKompas</a>","kompascom",14,FALSE,FALSE,NA,NA
"42","Kubu Agung Siapkan Pelaksana Tugas Pimpinan DPD Golkar Tingkat Provinsi  http://t.co/VpupM8kxS1",FALSE,4,NA,2015-04-02 13:26:28,FALSE,NA,"583621520485822464",NA,"<a href=""http://my.kompas.com"" rel=""nofollow"">MyKompas</a>","kompascom",5,FALSE,FALSE,NA,NA
"43","Curi Poin Jadi Target Semen Padang di Kandang Persib http://t.co/ev32f5ar7o",FALSE,7,NA,2015-04-02 13:24:30,FALSE,NA,"583621028124819456",NA,"<a href=""http://my.kompas.com"" rel=""nofollow"">MyKompas</a>","kompascom",4,FALSE,FALSE,NA,NA
"44","Iklan MMM Dinilai Penipuan Masal, Kemenkominfo Diminta Turun Tangan http://t.co/8AzFkIegfh",FALSE,7,NA,2015-04-02 13:18:24,FALSE,NA,"583619490761412608",NA,"<a href=""http://my.kompas.com"" rel=""nofollow"">MyKompas</a>","kompascom",19,FALSE,FALSE,NA,NA
"45","Apple Terima Tukar Tambah BlackBerry, Android, dan Windows Phone http://t.co/hPy0WdIeOz http://t.co/kosohzrB3N",FALSE,33,NA,2015-04-02 13:11:04,FALSE,NA,"583617644143575040",NA,"<a href=""http://www.socialbakers.com"" rel=""nofollow"">Socialbakers Builder</a>","kompascom",68,FALSE,FALSE,NA,NA
"46","Faisal Basri: Wapres ""Ngomong"" Beda, Presiden ""Ngomong"" Beda http://t.co/r5n5lUMhNG",FALSE,8,NA,2015-04-02 13:11:02,FALSE,NA,"583617637369819137",NA,"<a href=""http://www.socialbakers.com"" rel=""nofollow"">Socialbakers Builder</a>","kompascom",24,FALSE,FALSE,NA,NA
"47","Ronaldo dan Bale Diperlakukan Tidak Adil  http://t.co/iVR0Qtj9nR",FALSE,3,NA,2015-04-02 13:10:19,FALSE,NA,"583617456016498689",NA,"<a href=""http://my.kompas.com"" rel=""nofollow"">MyKompas</a>","kompascom",10,FALSE,FALSE,NA,NA
"48","Bulan Ini, Pemerintah Bentuk Tim Pansel KPK http://t.co/pY9TexrvJo",FALSE,5,NA,2015-04-02 13:08:18,FALSE,NA,"583616949264846848",NA,"<a href=""http://my.kompas.com"" rel=""nofollow"">MyKompas</a>","kompascom",7,FALSE,FALSE,NA,NA
"49","Karena Cinta, Marshanda Lanjutkan Langkah http://t.co/banc9qO4an",FALSE,6,NA,2015-04-02 13:06:30,FALSE,NA,"583616495529271297",NA,"<a href=""http://my.kompas.com"" rel=""nofollow"">MyKompas</a>","kompascom",3,FALSE,FALSE,NA,NA
"50","Gerombolan Bersenjata Serbu Universitas Kenya http://t.co/IzcaYHxSeF",FALSE,5,NA,2015-04-02 13:06:19,FALSE,NA,"583616451354832898",NA,"<a href=""http://my.kompas.com"" rel=""nofollow"">MyKompas</a>","kompascom",5,FALSE,FALSE,NA,NA
"51","Saksi Ahli: KPK Tak Bisa Hitung Sendiri Potensi Kerugian Keuangan Negara http://t.co/8utB5YyNZa",FALSE,2,NA,2015-04-02 13:02:19,FALSE,NA,"583615444491214850",NA,"<a href=""http://my.kompas.com"" rel=""nofollow"">MyKompas</a>","kompascom",6,FALSE,FALSE,NA,NA
"52","Lanjutkan Kenaikan, Rupiah Menguat ke Kisaran Rp 12.900 Per Dollar AS http://t.co/S7XI4GVqvj http://t.co/iqigDlzUpL",FALSE,6,NA,2015-04-02 13:01:14,FALSE,NA,"583615171202981888",NA,"<a href=""http://www.socialbakers.com"" rel=""nofollow"">Socialbakers Builder</a>","kompascom",29,FALSE,FALSE,NA,NA
"53","Naik Lagi, Harga Elpiji 12 Kg Jadi Rp 142.000 per Tabung http://t.co/MpzugHead4 http://t.co/eruyxQHaZt",FALSE,16,NA,2015-04-02 13:01:12,FALSE,NA,"583615164022333440",NA,"<a href=""http://www.socialbakers.com"" rel=""nofollow"">Socialbakers Builder</a>","kompascom",32,FALSE,FALSE,NA,NA
"54","Kemendagri Anggap RAPBD DKI Tak Rasional, Berikut Catatan Koreksinya  http://t.co/B1vl9YJ15p",FALSE,4,NA,2015-04-02 13:00:38,FALSE,NA,"583615021034246144",NA,"<a href=""http://my.kompas.com"" rel=""nofollow"">MyKompas</a>","kompascom",7,FALSE,FALSE,NA,NA
"55","Absen Bela Argentina, Messi Siap Tampil di Barcelona http://t.co/WOmm649Y22",FALSE,2,NA,2015-04-02 13:00:28,FALSE,NA,"583614977195388929",NA,"<a href=""http://my.kompas.com"" rel=""nofollow"">MyKompas</a>","kompascom",8,FALSE,FALSE,NA,NA
"56","Istri Pertama John Lennon Meninggal http://t.co/MeVQR8gaDY",FALSE,1,NA,2015-04-02 13:00:17,FALSE,NA,"583614933398491136",NA,"<a href=""http://my.kompas.com"" rel=""nofollow"">MyKompas</a>","kompascom",10,FALSE,FALSE,NA,NA
"57","Hadapi Berbagai Kasus Hukum, Agung Laksono Siapkan Lebih dari 30 Pengacara http://t.co/j96V2sdnry",FALSE,5,NA,2015-04-02 12:54:09,FALSE,NA,"583613389089464320",NA,"<a href=""http://my.kompas.com"" rel=""nofollow"">MyKompas</a>","kompascom",5,FALSE,FALSE,NA,NA
"58","Dubes AS Kecewa atas Vonis Guru JIS http://t.co/6zsvXFm82J",FALSE,5,NA,2015-04-02 12:52:08,FALSE,NA,"583612881322647552",NA,"<a href=""http://my.kompas.com"" rel=""nofollow"">MyKompas</a>","kompascom",4,FALSE,FALSE,NA,NA
"59","Saksi Ahli Suryadharma: Tak Mungkin Penetapan Tersangka di Awal Penyidikan http://t.co/4Yv69nywEH",FALSE,2,NA,2015-04-02 12:50:31,FALSE,NA,"583612474269675520",NA,"<a href=""http://my.kompas.com"" rel=""nofollow"">MyKompas</a>","kompascom",3,FALSE,FALSE,NA,NA
"60","Di Maria Tolak PSG?  http://t.co/hO0O75SxNx",FALSE,0,NA,2015-04-02 12:50:21,FALSE,NA,"583612430472740864",NA,"<a href=""http://my.kompas.com"" rel=""nofollow"">MyKompas</a>","kompascom",5,FALSE,FALSE,NA,NA
"61","Harga Jual Udang Dipatok di Bawah Pasar, Petambak Mengadu ke DPRD Lampung http://t.co/bJoMes8w6X",FALSE,2,NA,2015-04-02 12:50:10,FALSE,NA,"583612386474467328",NA,"<a href=""http://my.kompas.com"" rel=""nofollow"">MyKompas</a>","kompascom",2,FALSE,FALSE,NA,NA
"62","Prabowo Sambangi Aburizal Bakrie di Bakrie Tower http://t.co/WJqB5Lo0VH",FALSE,11,NA,2015-04-02 12:42:04,FALSE,NA,"583610345844936704",NA,"<a href=""http://my.kompas.com"" rel=""nofollow"">MyKompas</a>","kompascom",14,FALSE,FALSE,NA,NA
"63","Kerja Sama dengan Kemenkumham, TNI Bantu Jaga Penjara http://t.co/mJxQhRUXKO",FALSE,8,NA,2015-04-02 12:34:02,FALSE,NA,"583608326828597248",NA,"<a href=""http://my.kompas.com"" rel=""nofollow"">MyKompas</a>","kompascom",4,FALSE,FALSE,NA,NA
"64","Izin AirAsia Rute Surabaya ke Singapura akan Kembali Dibuka? http://t.co/e2ttZDuctf",FALSE,2,NA,2015-04-02 12:32:11,FALSE,NA,"583607859486695424",NA,"<a href=""http://my.kompas.com"" rel=""nofollow"">MyKompas</a>","kompascom",3,FALSE,FALSE,NA,NA
"65","Dinyatakan Bersalah, Guru JIS Divonis 10 Tahun Bui dalam Kasus Pelecehan Seks http://t.co/eaUxILcq58",FALSE,6,NA,2015-04-02 12:32:00,FALSE,NA,"583607815731683328",NA,"<a href=""http://my.kompas.com"" rel=""nofollow"">MyKompas</a>","kompascom",3,FALSE,FALSE,NA,NA
"66","""Perselisihan Okan Cornelius dengan Viviane Tidak Ada Habisnya"" http://t.co/GmKeHELQcb",FALSE,8,NA,2015-04-02 12:29:58,FALSE,NA,"583607303405862912",NA,"<a href=""http://my.kompas.com"" rel=""nofollow"">MyKompas</a>","kompascom",0,FALSE,FALSE,NA,NA
"67","Warga Adat Tolak Investor Kelola Tambang Emas http://t.co/RrJkFWe5iA",FALSE,4,NA,2015-04-02 12:27:57,FALSE,NA,"583606794863284226",NA,"<a href=""http://my.kompas.com"" rel=""nofollow"">MyKompas</a>","kompascom",12,FALSE,FALSE,NA,NA
"68","Pertamina: Kenaikan Harga ELpiji 12 Kg Kembali ke “Rule of The Game” http://t.co/PZaxd8JKTz",FALSE,7,NA,2015-04-02 12:26:02,FALSE,NA,"583606310861537280",NA,"<a href=""http://my.kompas.com"" rel=""nofollow"">MyKompas</a>","kompascom",6,FALSE,FALSE,NA,NA
"69","Penganiayaan Warga oleh Anggota Brimob Dipicu Suara Knalpot Motor http://t.co/MRR1yR0RNa",FALSE,7,NA,2015-04-02 12:23:54,FALSE,NA,"583605776083587072",NA,"<a href=""http://my.kompas.com"" rel=""nofollow"">MyKompas</a>","kompascom",10,FALSE,FALSE,NA,NA
"70","Temui Agung Laksono di DPP Golkar, Eggi Sudjana Beri Pendapat soal Hukum  http://t.co/YEVvjgqLe4",FALSE,7,NA,2015-04-02 12:21:54,FALSE,NA,"583605272624508928",NA,"<a href=""http://my.kompas.com"" rel=""nofollow"">MyKompas</a>","kompascom",5,FALSE,FALSE,NA,NA
"71","Pelaku Pengolahan Air Zamzam Klaim Belajar dari Orang Arab http://t.co/AAjHC7hNxH",FALSE,5,NA,2015-04-02 12:19:53,FALSE,NA,"583604766757888001",NA,"<a href=""http://my.kompas.com"" rel=""nofollow"">MyKompas</a>","kompascom",11,FALSE,FALSE,NA,NA
"72","Bupati Tasik Minta Perhutani Dibubarkan karena Dinilai Kerap Picu Konflik http://t.co/P1XC0EF8Vx",FALSE,4,NA,2015-04-02 12:17:52,FALSE,NA,"583604259133886464",NA,"<a href=""http://my.kompas.com"" rel=""nofollow"">MyKompas</a>","kompascom",10,FALSE,FALSE,NA,NA
"73","Diduga Langgar Lampu Merah, Dua Pengendara Motor Tewas Terlindas Bus http://t.co/SlXuFfcdys",FALSE,2,NA,2015-04-02 12:13:51,FALSE,NA,"583603245529989122",NA,"<a href=""http://my.kompas.com"" rel=""nofollow"">MyKompas</a>","kompascom",3,FALSE,FALSE,NA,NA
"74","Syarat Gubernur DIY Dinilai Multitafsir http://t.co/rs3I1bOSp4",FALSE,4,NA,2015-04-02 12:11:51,FALSE,NA,"583602741827637250",NA,"<a href=""http://my.kompas.com"" rel=""nofollow"">MyKompas</a>","kompascom",6,FALSE,FALSE,NA,NA
"75","Kata Kalla, Tunjangan Uang Muka Mobil Naik karena Harga Mobil Naik  http://t.co/Yem2lM4Shf",FALSE,6,NA,2015-04-02 12:11:40,FALSE,NA,"583602698194296832",NA,"<a href=""http://my.kompas.com"" rel=""nofollow"">MyKompas</a>","kompascom",6,FALSE,FALSE,NA,NA
"76","Kemdagri Koreksi 280 Halaman pada Rapergub APBD DKI 2015 http://t.co/h40rSs0TVr",FALSE,1,NA,2015-04-02 12:09:47,FALSE,NA,"583602224196005890",NA,"<a href=""http://my.kompas.com"" rel=""nofollow"">MyKompas</a>","kompascom",1,FALSE,FALSE,NA,NA
"77","Warna Mata Bisa Diubah dengan Operasi Laser http://t.co/tliO4AM50t",FALSE,3,NA,2015-04-02 12:08:00,FALSE,NA,"583601773958471682",NA,"<a href=""http://my.kompas.com"" rel=""nofollow"">MyKompas</a>","kompascom",5,FALSE,FALSE,NA,NA
"78","De Gea Belum Berpikir Gantikan Casillas http://t.co/79mmX2AQyL",FALSE,5,NA,2015-04-02 12:07:49,FALSE,NA,"583601730237042688",NA,"<a href=""http://my.kompas.com"" rel=""nofollow"">MyKompas</a>","kompascom",5,FALSE,FALSE,NA,NA
"79","Membangun Bogor Tidak Bisa Sembarangan! http://t.co/LaxDLxwi50.",FALSE,3,NA,2015-04-02 12:06:25,FALSE,NA,"583601375637934081",NA,"<a href=""http://my.kompas.com"" rel=""nofollow"">MyKompas</a>","kompascom",11,FALSE,FALSE,NA,NA
"80","Konsumsi Obat Hipertensi Pengaruhi Kualitas Ereksi? http://t.co/UN93mahoPT",FALSE,2,NA,2015-04-02 12:06:24,FALSE,NA,"583601373503041537",NA,"<a href=""http://my.kompas.com"" rel=""nofollow"">MyKompas</a>","kompascom",3,FALSE,FALSE,NA,NA
"81","Sedekah Sampah di Sekolah, Siapa Mau Ikut? http://t.co/Lq0Mds1nb6",FALSE,2,NA,2015-04-02 12:06:14,FALSE,NA,"583601329689370625",NA,"<a href=""http://my.kompas.com"" rel=""nofollow"">MyKompas</a>","kompascom",6,FALSE,FALSE,NA,NA
"82","Hujan Lebat di Jakarta, dari Genangan Hingga Gudang Terseret Masuk ke Kali http://t.co/2qjax0g1RI",FALSE,3,NA,2015-04-02 12:06:03,FALSE,NA,"583601285326209024",NA,"<a href=""http://my.kompas.com"" rel=""nofollow"">MyKompas</a>","kompascom",10,FALSE,FALSE,NA,NA
"83","Kasus Air Zamzam, Fenomena Gunung Es Pengawasan Produk Palsu http://t.co/4gEIGdO5vV",FALSE,5,NA,2015-04-02 12:05:53,FALSE,NA,"583601241634152448",NA,"<a href=""http://my.kompas.com"" rel=""nofollow"">MyKompas</a>","kompascom",10,FALSE,FALSE,NA,NA
"84","Bantah Disetir Aburizal, Keluarga Kecewa Mendiang Kader Golkar Jatim Diseret ke Politik http://t.co/krQHHIFiYd",FALSE,1,NA,2015-04-02 12:04:09,FALSE,NA,"583600806919671809",NA,"<a href=""http://my.kompas.com"" rel=""nofollow"">MyKompas</a>","kompascom",8,FALSE,FALSE,NA,NA
"85","Hati-hati, MMM Dikemas Seolah-olah ""Amil Zakat"" http://t.co/zMjzaslbP7",FALSE,5,NA,2015-04-02 12:03:59,FALSE,NA,"583600762548170752",NA,"<a href=""http://my.kompas.com"" rel=""nofollow"">MyKompas</a>","kompascom",19,FALSE,FALSE,NA,NA
"86","Ruben Onsu Akui Persahabatannya dengan Olga Syahputra Tak Sempurna http://t.co/ZJruYgPkXh",FALSE,16,NA,2015-04-02 12:03:48,FALSE,NA,"583600718847741952",NA,"<a href=""http://my.kompas.com"" rel=""nofollow"">MyKompas</a>","kompascom",14,FALSE,FALSE,NA,NA
"87","Wewey Wita: Mencari Kepingan yang Hilang http://t.co/9hia8CjXfv",FALSE,1,NA,2015-04-02 12:01:43,FALSE,NA,"583600195104968704",NA,"<a href=""http://my.kompas.com"" rel=""nofollow"">MyKompas</a>","kompascom",2,FALSE,FALSE,NA,NA
"88","Amankan Kebaktian Jumat Agung dan Paskah, 700 Polisi Disiagakan http://t.co/QYn3QVwRaC",FALSE,6,NA,2015-04-02 11:55:42,FALSE,NA,"583598679837122560",NA,"<a href=""http://my.kompas.com"" rel=""nofollow"">MyKompas</a>","kompascom",14,FALSE,FALSE,NA,NA
"89","Ditolak Warga Sekitar, WNI Terduga ISIS Batal Pulang ke Rumah http://t.co/FPtUmkCZTn",FALSE,6,NA,2015-04-02 11:53:39,FALSE,NA,"583598163782537216",NA,"<a href=""http://my.kompas.com"" rel=""nofollow"">MyKompas</a>","kompascom",9,FALSE,FALSE,NA,NA
"90","Operasi Simpatik, Polisi Tetap Bisa Tilang Pelanggar http://t.co/aYyhlV9Hwc",FALSE,5,NA,2015-04-02 11:51:39,FALSE,NA,"583597657987289088",NA,"<a href=""http://my.kompas.com"" rel=""nofollow"">MyKompas</a>","kompascom",6,FALSE,FALSE,NA,NA
"91","Panasonic Incar Pertumbuhan Penjualan Segmen Korporasi 140 Persen http://t.co/RqRf9tRmGZ",FALSE,2,NA,2015-04-02 11:49:29,FALSE,NA,"583597115298840577",NA,"<a href=""http://my.kompas.com"" rel=""nofollow"">MyKompas</a>","kompascom",2,FALSE,FALSE,NA,NA
"92","Kemenkominfo Bentuk Forum Penanganan Situs Bermuatan Negatif http://t.co/jCval0JYI8",FALSE,7,NA,2015-04-02 11:47:37,FALSE,NA,"583596643557085184",NA,"<a href=""http://my.kompas.com"" rel=""nofollow"">MyKompas</a>","kompascom",6,FALSE,FALSE,NA,NA
"93","Jelang Lawan Liverpool, Wenger Sanjung Sterling http://t.co/GnvsCPnZAL",FALSE,3,NA,2015-04-02 11:43:43,FALSE,NA,"583595665462177793",NA,"<a href=""http://my.kompas.com"" rel=""nofollow"">MyKompas</a>","kompascom",5,FALSE,FALSE,NA,NA
"94","Pengacara: Sudah Sepakat, Harusnya Hengki Kawilarang Tak Ditahan http://t.co/sffA1qpDwS",FALSE,3,NA,2015-04-02 11:43:37,FALSE,NA,"583595639981735937",NA,"<a href=""http://my.kompas.com"" rel=""nofollow"">MyKompas</a>","kompascom",2,FALSE,FALSE,NA,NA
"95","Bandung Paling Potensial Jadi ""Smart City"" http://t.co/46S1zhWRk2",FALSE,8,NA,2015-04-02 11:41:34,FALSE,NA,"583595121205096449",NA,"<a href=""http://my.kompas.com"" rel=""nofollow"">MyKompas</a>","kompascom",27,FALSE,FALSE,NA,NA
"96","Setelah Temui Jokowi, Bos AirAsia Tertarik Buka Rute ke Labuan Bajo dan Sorong http://t.co/7Rj16rVXdd",FALSE,4,NA,2015-04-02 11:39:46,FALSE,NA,"583594669176557568",NA,"<a href=""http://my.kompas.com"" rel=""nofollow"">MyKompas</a>","kompascom",15,FALSE,FALSE,NA,NA
"97","Amankan Rangkaian Perayaan Paskah di Palu, Penjinak Bom Disiagakan  http://t.co/r1j4I36o2V",FALSE,3,NA,2015-04-02 11:39:35,FALSE,NA,"583594624775651331",NA,"<a href=""http://my.kompas.com"" rel=""nofollow"">MyKompas</a>","kompascom",2,FALSE,FALSE,NA,NA
"98","Istana: Kenaikan Uang Muka untuk Beli Mobil Pejabat atas Permintaan Ketua DPR http://t.co/XfZQBT60nR",FALSE,4,NA,2015-04-02 11:35:31,FALSE,NA,"583593597808746496",NA,"<a href=""http://my.kompas.com"" rel=""nofollow"">MyKompas</a>","kompascom",17,FALSE,FALSE,NA,NA
"99","Misi Mulia Bali United di ISL 2015 http://t.co/Mopn3PbHhC",FALSE,4,NA,2015-04-02 11:33:30,FALSE,NA,"583593091082256385",NA,"<a href=""http://my.kompas.com"" rel=""nofollow"">MyKompas</a>","kompascom",2,FALSE,FALSE,NA,NA
"100","Kemendagri ""Ngebut"" Sahkan APBD DKI 2015  http://t.co/XOIQk2z5k3",FALSE,3,NA,2015-04-02 11:31:29,FALSE,NA,"583592584305479680",NA,"<a href=""http://my.kompas.com"" rel=""nofollow"">MyKompas</a>","kompascom",4,FALSE,FALSE,NA,NA
"101","James Bond ""KW"" Jadi Duta Lotus Evora http://t.co/Y11qhGHi0M",FALSE,2,NA,2015-04-02 11:25:40,FALSE,NA,"583591119256031233",NA,"<a href=""http://my.kompas.com"" rel=""nofollow"">MyKompas</a>","kompascom",3,FALSE,FALSE,NA,NA
"102","Christi Colondam Hanya Bisa Pasrah Saat ""Ditodong"" http://t.co/1vSPxKqJnC",FALSE,7,NA,2015-04-02 11:25:29,FALSE,NA,"583591075194937344",NA,"<a href=""http://my.kompas.com"" rel=""nofollow"">MyKompas</a>","kompascom",1,FALSE,FALSE,NA,NA
"103","""Perundangan Pidana Khusus Melemah Jika Masuk ke dalam Rancangan KUHP"" http://t.co/dvRWgIzcV1",FALSE,1,NA,2015-04-02 11:23:43,FALSE,NA,"583590632280596480",NA,"<a href=""http://my.kompas.com"" rel=""nofollow"">MyKompas</a>","kompascom",3,FALSE,FALSE,NA,NA
