"","text","favorited","favoriteCount","replyToSN","created","truncated","replyToSID","id","replyToUID","statusSource","screenName","retweetCount","isRetweet","retweeted","longitude","latitude"
"310","JK: Kenapa Harus Ada Ujian Nasional?  http://t.co/BShvO7GsdG",FALSE,8,NA,2015-04-02 04:38:00,FALSE,NA,"583488527834324992",NA,"<a href=""http://my.kompas.com"" rel=""nofollow"">MyKompas</a>","kompascom",15,FALSE,FALSE,NA,NA
"311","Naikkan Uang Muka Mobil Pejabat, Jokowi Dianggap Tak Berpihak pada Rakyat http://t.co/ISowPYmvii",FALSE,4,NA,2015-04-02 04:34:00,FALSE,NA,"583487519607533568",NA,"<a href=""http://my.kompas.com"" rel=""nofollow"">MyKompas</a>","kompascom",24,FALSE,FALSE,NA,NA
"312","Pesan di Balik Terbitnya Pergub bagi M Taufik... http://t.co/MhH8lDYALT",FALSE,0,NA,2015-04-02 04:30:11,FALSE,NA,"583486562542882817",NA,"<a href=""http://my.kompas.com"" rel=""nofollow"">MyKompas</a>","kompascom",3,FALSE,FALSE,NA,NA
"313","Datangi KPK, Hamzah Haz Besuk Fuad Amin http://t.co/QPCYf0d3iV",FALSE,2,NA,2015-04-02 04:30:01,FALSE,NA,"583486517550518272",NA,"<a href=""http://my.kompas.com"" rel=""nofollow"">MyKompas</a>","kompascom",4,FALSE,FALSE,NA,NA
"314","Wakapolri Raker dengan Komisi III DPR Bahas Kinerja Polri http://t.co/V2soPHshv1",FALSE,1,NA,2015-04-02 04:27:56,FALSE,NA,"583485995712057344",NA,"<a href=""http://my.kompas.com"" rel=""nofollow"">MyKompas</a>","kompascom",7,FALSE,FALSE,NA,NA
"315","Revitalisasi Kota Tua Jangan untuk Kepentingan Swasta http://t.co/Z7g1XetguJ",FALSE,3,NA,2015-04-02 04:23:54,FALSE,NA,"583484978895257600",NA,"<a href=""http://my.kompas.com"" rel=""nofollow"">MyKompas</a>","kompascom",11,FALSE,FALSE,NA,NA
"316","Daripada Gandeng Swasta, Mending BUMD ""Digendong"" Pertamina http://t.co/ZcfK4SE549.",FALSE,2,NA,2015-04-02 04:18:03,FALSE,NA,"583483505784459264",NA,"<a href=""http://my.kompas.com"" rel=""nofollow"">MyKompas</a>","kompascom",10,FALSE,FALSE,NA,NA
"317","Kunjungi AS, Abe Diharapkan Minta Maaf atas Kejahatan Perang Jepang http://t.co/u4B8CxPoeV",FALSE,4,NA,2015-04-02 04:17:52,FALSE,NA,"583483462071390208",NA,"<a href=""http://my.kompas.com"" rel=""nofollow"">MyKompas</a>","kompascom",5,FALSE,FALSE,NA,NA
"318","Kerja di Kapal Pesiar Masih Banyak Diminati TKI Asal Bali http://t.co/gS7Kzl6YiP",FALSE,3,NA,2015-04-02 04:13:52,FALSE,NA,"583482453915901952",NA,"<a href=""http://my.kompas.com"" rel=""nofollow"">MyKompas</a>","kompascom",3,FALSE,FALSE,NA,NA
"319","Presiden Terpilih Nigeria Bertekad Kalahkan Boko Haram http://t.co/jnbys2BNLs http://t.co/9wHYXZpgsK",FALSE,12,NA,2015-04-02 04:07:17,FALSE,NA,"583480797904015360",NA,"<a href=""http://twitter.com"" rel=""nofollow"">Twitter Web Client</a>","kompascom",14,FALSE,FALSE,NA,NA
"320","Beraktivitas ""Outdoor"" Pun Bisa Tetap Modis http://t.co/bi9FGH0ZrJ",FALSE,4,NA,2015-04-02 04:06:38,FALSE,NA,"583480632983982081",NA,"<a href=""http://my.kompas.com"" rel=""nofollow"">MyKompas</a>","kompascom",9,FALSE,FALSE,NA,NA
"321","Kecuali Jepang, Kinerja Hotel Asia Pasifik Anjlok http://t.co/O6d4UAawT3",FALSE,4,NA,2015-04-02 04:06:27,FALSE,NA,"583480588809576448",NA,"<a href=""http://my.kompas.com"" rel=""nofollow"">MyKompas</a>","kompascom",5,FALSE,FALSE,NA,NA
"322","Sayuran Hijau Juga Memicu Terbentuknya Batu Ginjal http://t.co/wiVeaP6e52",FALSE,9,NA,2015-04-02 04:06:17,FALSE,NA,"583480544693878785",NA,"<a href=""http://my.kompas.com"" rel=""nofollow"">MyKompas</a>","kompascom",14,FALSE,FALSE,NA,NA
"323","Sriwijaya FC Fokus Latihan Taktik  http://t.co/jUmR0e8qYX.",FALSE,2,NA,2015-04-02 04:06:06,FALSE,NA,"583480500582391808",NA,"<a href=""http://my.kompas.com"" rel=""nofollow"">MyKompas</a>","kompascom",3,FALSE,FALSE,NA,NA
"324","Petinggi PDI-P Dituduh Keroyok Kadernya di Kantor Lenteng Agung http://t.co/tAgMXqqIUE",FALSE,4,NA,2015-04-02 04:03:45,FALSE,NA,"583479909051342848",NA,"<a href=""http://my.kompas.com"" rel=""nofollow"">MyKompas</a>","kompascom",7,FALSE,FALSE,NA,NA
"325","Ahok Pastikan Tunjangan Besar PNS Tak Diubah http://t.co/fygwp5fhug",FALSE,5,NA,2015-04-02 04:01:57,FALSE,NA,"583479455810654208",NA,"<a href=""http://my.kompas.com"" rel=""nofollow"">MyKompas</a>","kompascom",8,FALSE,FALSE,NA,NA
"326","Empat Deputi dan Dua Staf Khusus Kantor Staf Kepresidenan Resmi Dilantik http://t.co/qwllrMC1YR",FALSE,2,NA,2015-04-02 04:01:47,FALSE,NA,"583479412118564864",NA,"<a href=""http://my.kompas.com"" rel=""nofollow"">MyKompas</a>","kompascom",4,FALSE,FALSE,NA,NA
"327","Halep Tantang Serena di Semifinal Miami http://t.co/xIQm27ImUw",FALSE,0,NA,2015-04-02 03:57:43,FALSE,NA,"583478392311283713",NA,"<a href=""http://my.kompas.com"" rel=""nofollow"">MyKompas</a>","kompascom",3,FALSE,FALSE,NA,NA
"328","Demi Gusur Arsenal, Rooney Serukan Kemenangan di Old Trafford http://t.co/DkvW7ffaRg.",FALSE,2,NA,2015-04-02 03:51:49,FALSE,NA,"583476906974023680",NA,"<a href=""http://my.kompas.com"" rel=""nofollow"">MyKompas</a>","kompascom",10,FALSE,FALSE,NA,NA
"329","Polisi Kembali Periksa Saksi Kasus Komentar ""Rakyat Tidak Jelas"" Menteri Tedjo http://t.co/VPVeS8Bf8C",FALSE,3,NA,2015-04-02 03:51:39,FALSE,NA,"583476863042854913",NA,"<a href=""http://my.kompas.com"" rel=""nofollow"">MyKompas</a>","kompascom",6,FALSE,FALSE,NA,NA
"330","FITRA: Ironis, Jokowi Tambah Uang Muka Mobil Pejabat di Tengah Naiknya Harga BBM http://t.co/KEXpUd11Er",FALSE,8,NA,2015-04-02 03:43:57,FALSE,NA,"583474927342198784",NA,"<a href=""http://my.kompas.com"" rel=""nofollow"">MyKompas</a>","kompascom",68,FALSE,FALSE,NA,NA
"331","Manuver 3 Shukoi di Langit Ambon Hebohkan Warga http://t.co/4l2tuLRWbS",FALSE,1,NA,2015-04-02 03:43:47,FALSE,NA,"583474883499204608",NA,"<a href=""http://my.kompas.com"" rel=""nofollow"">MyKompas</a>","kompascom",9,FALSE,FALSE,NA,NA
"332","Hugo Barra: Strategi ""Umur Panjang"" Xiaomi Susah Ditiru http://t.co/DX0DsNApD8",FALSE,7,NA,2015-04-02 03:43:36,FALSE,NA,"583474839677083649",NA,"<a href=""http://my.kompas.com"" rel=""nofollow"">MyKompas</a>","kompascom",6,FALSE,FALSE,NA,NA
"333","Gerrard Beli ""Istana"" Rp 332 Miliar di Malibu http://t.co/aouLookTUO",FALSE,4,NA,2015-04-02 03:39:45,FALSE,NA,"583473871107461121",NA,"<a href=""http://my.kompas.com"" rel=""nofollow"">MyKompas</a>","kompascom",9,FALSE,FALSE,NA,NA
"334","Tim Anti Mafia Migas Beberkan Kecurangan Petral http://t.co/qH6vLGtY4u",FALSE,3,NA,2015-04-02 03:39:35,FALSE,NA,"583473826790383616",NA,"<a href=""http://my.kompas.com"" rel=""nofollow"">MyKompas</a>","kompascom",10,FALSE,FALSE,NA,NA
"335","Demi Urus Ibu yang Sakit Menahun, Bocah Akbar Putus Sekolah   http://t.co/nN2Mct3S2N",FALSE,5,NA,2015-04-02 03:35:29,FALSE,NA,"583472797009051648",NA,"<a href=""http://my.kompas.com"" rel=""nofollow"">MyKompas</a>","kompascom",15,FALSE,FALSE,NA,NA
"336","Kisah Gadis di Bawah Umur Dijadikan Penari Striptis http://t.co/22M78LiGTP",FALSE,21,NA,2015-04-02 03:31:31,FALSE,NA,"583471795216318465",NA,"<a href=""http://my.kompas.com"" rel=""nofollow"">MyKompas</a>","kompascom",10,FALSE,FALSE,NA,NA
"337","Salam Komando Damai ala Ahok dan Ketua DPRD http://t.co/23k0LKEdfx",FALSE,3,NA,2015-04-02 03:29:39,FALSE,NA,"583471328818171904",NA,"<a href=""http://my.kompas.com"" rel=""nofollow"">MyKompas</a>","kompascom",4,FALSE,FALSE,NA,NA
"338","Parasetamol Tak Efektif untuk Nyeri Punggung http://t.co/wwSQTVPdR4",FALSE,2,NA,2015-04-02 03:29:29,FALSE,NA,"583471284576657408",NA,"<a href=""http://my.kompas.com"" rel=""nofollow"">MyKompas</a>","kompascom",5,FALSE,FALSE,NA,NA
"339","Rio Haryanto Belum Maksimal pada Hari Pertama Tes Pra-musim GP2 2015 di Bahrain http://t.co/ikDoLNyjgD",FALSE,1,NA,2015-04-02 03:27:27,FALSE,NA,"583470774549286912",NA,"<a href=""http://my.kompas.com"" rel=""nofollow"">MyKompas</a>","kompascom",8,FALSE,FALSE,NA,NA
"340","Konflik Internal Berkepanjangan Turunkan Kepiawaian Politik Golkar http://t.co/xvq5MiWNvH",FALSE,1,NA,2015-04-02 03:22:05,FALSE,NA,"583469423014457345",NA,"<a href=""http://my.kompas.com"" rel=""nofollow"">MyKompas</a>","kompascom",7,FALSE,FALSE,NA,NA
"341","Paspor Eks Pemain MU Laku Rp 96 Juta di eBay http://t.co/YRprKEbj6T",FALSE,0,NA,2015-04-02 03:21:54,FALSE,NA,"583469379204939777",NA,"<a href=""http://my.kompas.com"" rel=""nofollow"">MyKompas</a>","kompascom",5,FALSE,FALSE,NA,NA
"342","Liburan Unik di Desa Berpenduduk 9 Orang di Perancis! - 2 http://t.co/GCLXZXkdAQ",FALSE,4,NA,2015-04-02 03:21:44,FALSE,NA,"583469334963466241",NA,"<a href=""http://my.kompas.com"" rel=""nofollow"">MyKompas</a>","kompascom",14,FALSE,FALSE,NA,NA
"343","Menkominfo Sebut Titik Terang 4G Tahap Dua http://t.co/F3iSmEBMTd",FALSE,6,NA,2015-04-02 03:21:33,FALSE,NA,"583469288914169856",NA,"<a href=""http://my.kompas.com"" rel=""nofollow"">MyKompas</a>","kompascom",4,FALSE,FALSE,NA,NA
"344","Kemenlu: 100 WNI Masih Terjebak Pertempuran di Kota Aden http://t.co/9xHkWRJ2EJ",FALSE,4,NA,2015-04-02 03:17:22,FALSE,NA,"583468234617126912",NA,"<a href=""http://my.kompas.com"" rel=""nofollow"">MyKompas</a>","kompascom",4,FALSE,FALSE,NA,NA
"345","Pembunuh Istri Mantan Ketua MUI, Juga Bunuh Waria Kekasihnya http://t.co/58uVDvSs2j",FALSE,9,NA,2015-04-02 03:15:20,FALSE,NA,"583467725969698818",NA,"<a href=""http://my.kompas.com"" rel=""nofollow"">MyKompas</a>","kompascom",3,FALSE,FALSE,NA,NA
"346","Operasi Simpatik, ""Busway"" Diserobot Dibiarkan http://t.co/gdjIxWDFNm",FALSE,2,NA,2015-04-02 03:13:22,FALSE,NA,"583467228403597312",NA,"<a href=""http://my.kompas.com"" rel=""nofollow"">MyKompas</a>","kompascom",4,FALSE,FALSE,NA,NA
"347","PSO Berubah,  ""Single Tariff"" Kereta Bandung Raya Dihilangkan http://t.co/43vhetZTIh",FALSE,1,NA,2015-04-02 03:11:25,FALSE,NA,"583466738676707329",NA,"<a href=""http://my.kompas.com"" rel=""nofollow"">MyKompas</a>","kompascom",7,FALSE,FALSE,NA,NA
"348","Setelah Pogba, Juve Ingin Kembali Rekrut Pemain Buangan MU http://t.co/pcEso64PWX",FALSE,3,NA,2015-04-02 03:09:31,FALSE,NA,"583466260014309376",NA,"<a href=""http://my.kompas.com"" rel=""nofollow"">MyKompas</a>","kompascom",9,FALSE,FALSE,NA,NA
"349","Penampakan Topan Maysak, yang Akan  Terjang Filipina, dari Luar Angkasa http://t.co/51GVnxQWrc",FALSE,1,NA,2015-04-02 03:09:20,FALSE,NA,"583466216267714560",NA,"<a href=""http://my.kompas.com"" rel=""nofollow"">MyKompas</a>","kompascom",7,FALSE,FALSE,NA,NA
"350","Polisi Gelar Aksi Simpatik Bagi-bagi Akik http://t.co/V50putckc0",FALSE,3,NA,2015-04-02 03:05:42,FALSE,NA,"583465298390421505",NA,"<a href=""http://my.kompas.com"" rel=""nofollow"">MyKompas</a>","kompascom",10,FALSE,FALSE,NA,NA
"351","Wah, David Beckham Temani Anak Berkencan http://t.co/fmclCj0WVv",FALSE,3,NA,2015-04-02 03:05:20,FALSE,NA,"583465209899065345",NA,"<a href=""http://my.kompas.com"" rel=""nofollow"">MyKompas</a>","kompascom",4,FALSE,FALSE,NA,NA
"352","Ahok Janji Penuhi Undangan Paripurna Penyampaian LKPJ 2014 http://t.co/STJw16ukGh",FALSE,3,NA,2015-04-02 02:59:26,FALSE,NA,"583463724716924928",NA,"<a href=""http://my.kompas.com"" rel=""nofollow"">MyKompas</a>","kompascom",2,FALSE,FALSE,NA,NA
"353","Menjajal Xiaomi Redmi 2 di Jakarta http://t.co/IxwhALvaS9",FALSE,12,NA,2015-04-02 02:59:16,FALSE,NA,"583463680332791809",NA,"<a href=""http://my.kompas.com"" rel=""nofollow"">MyKompas</a>","kompascom",8,FALSE,FALSE,NA,NA
"354","Penjelasan Toyota Indonesia Soal Investasi Rp 20 Triliun http://t.co/X5E7MRAWjf",FALSE,2,NA,2015-04-02 02:53:21,FALSE,NA,"583462190591541248",NA,"<a href=""http://my.kompas.com"" rel=""nofollow"">MyKompas</a>","kompascom",6,FALSE,FALSE,NA,NA
"355","Masihkah Jokowi Berkomitmen Hemat Anggaran Pembelian Mobil Pejabat? http://t.co/INicBMfydL",FALSE,13,NA,2015-04-02 02:53:10,FALSE,NA,"583462146299703296",NA,"<a href=""http://my.kompas.com"" rel=""nofollow"">MyKompas</a>","kompascom",18,FALSE,FALSE,NA,NA
"356","Manggis Lebak Tembus Pasar Jepang http://t.co/fn4hjtjqlb",FALSE,6,NA,2015-04-02 02:51:08,FALSE,NA,"583461633365671937",NA,"<a href=""http://my.kompas.com"" rel=""nofollow"">MyKompas</a>","kompascom",9,FALSE,FALSE,NA,NA
"357","Tjatur: Ada yang Intervensi BNPT dan Menkominfo untuk Blokir Situs http://t.co/wBGKRe7jWq",FALSE,3,NA,2015-04-02 02:49:20,FALSE,NA,"583461179411927041",NA,"<a href=""http://my.kompas.com"" rel=""nofollow"">MyKompas</a>","kompascom",7,FALSE,FALSE,NA,NA
"358","Pangkas Anggaran, Ahok Ingin Beli Tanah Sebanyak-banyaknya untuk DKI http://t.co/kpCOluvoBh",FALSE,3,NA,2015-04-02 02:49:09,FALSE,NA,"583461135044608001",NA,"<a href=""http://my.kompas.com"" rel=""nofollow"">MyKompas</a>","kompascom",7,FALSE,FALSE,NA,NA
"359","Jelang Liburan, IHSG Awal Sesi Dibuka Naik http://t.co/QYhEHr64Z5",FALSE,4,NA,2015-04-02 02:43:04,FALSE,NA,"583459602500431873",NA,"<a href=""http://my.kompas.com"" rel=""nofollow"">MyKompas</a>","kompascom",4,FALSE,FALSE,NA,NA
"360","Naikkan Uang Muka Mobil Pejabat, Jokowi Sedang Mencari ""Teman"" http://t.co/E9WrYLZN3L",FALSE,13,NA,2015-04-02 02:41:51,FALSE,NA,"583459299155771392",NA,"<a href=""http://my.kompas.com"" rel=""nofollow"">MyKompas</a>","kompascom",16,FALSE,FALSE,NA,NA
"361","43 Orang Tewas setelah Kapal Pukat Rusia Tenggelam di Pasifik http://t.co/lrzc0wLUAj",FALSE,5,NA,2015-04-02 02:41:41,FALSE,NA,"583459255333728256",NA,"<a href=""http://my.kompas.com"" rel=""nofollow"">MyKompas</a>","kompascom",4,FALSE,FALSE,NA,NA
"362","Beranikah Anggota DPR Kritik Jokowi soal Kenaikan Uang Muka Mobil? http://t.co/o9W30hx8Ln",FALSE,9,NA,2015-04-02 02:41:30,FALSE,NA,"583459211633233920",NA,"<a href=""http://my.kompas.com"" rel=""nofollow"">MyKompas</a>","kompascom",12,FALSE,FALSE,NA,NA
"363","Operasi Simpatik, Mana Kanalisasi Kendaraan di Cawang-Kuningan? http://t.co/uAvp36PUY3",FALSE,0,NA,2015-04-02 02:41:20,FALSE,NA,"583459167488249860",NA,"<a href=""http://my.kompas.com"" rel=""nofollow"">MyKompas</a>","kompascom",3,FALSE,FALSE,NA,NA
"364","Kia Gebrak New York dengan Optima Terbaru http://t.co/sGNGC7X5HL",FALSE,2,NA,2015-04-02 02:41:09,FALSE,NA,"583459123498459136",NA,"<a href=""http://my.kompas.com"" rel=""nofollow"">MyKompas</a>","kompascom",5,FALSE,FALSE,NA,NA
"365","Inter Siapkan Rp 836 Miliar untuk Boyong Bintang City http://t.co/T5vK9TNCTo",FALSE,5,NA,2015-04-02 02:37:02,FALSE,NA,"583458084250525698",NA,"<a href=""http://my.kompas.com"" rel=""nofollow"">MyKompas</a>","kompascom",5,FALSE,FALSE,NA,NA
"366","Penjelasan Anak Alex Usman soal Pengadaan Buku Didanai APBD DKI http://t.co/vIKno4KQPv",FALSE,2,NA,2015-04-02 02:33:12,FALSE,NA,"583457122794409984",NA,"<a href=""http://my.kompas.com"" rel=""nofollow"">MyKompas</a>","kompascom",1,FALSE,FALSE,NA,NA
"367","Medan ""Off Road"" Terlalu Berat, Wapres Batal Tembus Pelabuhan Cilayama   http://t.co/HR91Y3ipEj",FALSE,3,NA,2015-04-02 02:33:02,FALSE,NA,"583457078154407937",NA,"<a href=""http://my.kompas.com"" rel=""nofollow"">MyKompas</a>","kompascom",4,FALSE,FALSE,NA,NA
"368","Masa Konflik, Tari Rabbani Wahid Tetap Hidup di Bireuen http://t.co/fDR3y0CqqA",FALSE,4,NA,2015-04-02 02:26:57,FALSE,NA,"583455547548020736",NA,"<a href=""http://my.kompas.com"" rel=""nofollow"">MyKompas</a>","kompascom",2,FALSE,FALSE,NA,NA
"369","Dua Warga Negara Thailand Ikut Rombongan Evakuasi WNI di Yaman http://t.co/OgJLCovlMx",FALSE,1,NA,2015-04-02 02:24:55,FALSE,NA,"583455035796762625",NA,"<a href=""http://my.kompas.com"" rel=""nofollow"">MyKompas</a>","kompascom",2,FALSE,FALSE,NA,NA
"370","4G LTE Telkomsel Hadir di Medan http://t.co/rq5QXfo23W",FALSE,1,NA,2015-04-02 02:22:53,FALSE,NA,"583454525081559041",NA,"<a href=""http://my.kompas.com"" rel=""nofollow"">MyKompas</a>","kompascom",8,FALSE,FALSE,NA,NA
"371","Lanjutkan Kenaikan, Rupiah Menguat ke Kisaran Rp 12.900 Per Dollar AS http://t.co/S7XI4GVqvj",FALSE,6,NA,2015-04-02 02:20:52,FALSE,NA,"583454019181350912",NA,"<a href=""http://my.kompas.com"" rel=""nofollow"">MyKompas</a>","kompascom",20,FALSE,FALSE,NA,NA
"372","Liverpool Melemah Tanpa Gerrard dan Suarez http://t.co/A6RcLHFBRe",FALSE,5,NA,2015-04-02 02:18:51,FALSE,NA,"583453510215213056",NA,"<a href=""http://my.kompas.com"" rel=""nofollow"">MyKompas</a>","kompascom",15,FALSE,FALSE,NA,NA
"373","Pembunuh Mantan Istri Ketua MUI Sulut Ditangkap http://t.co/x08oELlR7r",FALSE,0,NA,2015-04-02 02:16:51,FALSE,NA,"583453008266006529",NA,"<a href=""http://my.kompas.com"" rel=""nofollow"">MyKompas</a>","kompascom",6,FALSE,FALSE,NA,NA
"374","Tapak Swadaya di Lembah Rinjani http://t.co/KkxMD4uUUl",FALSE,5,NA,2015-04-02 02:12:49,FALSE,NA,"583451992258842624",NA,"<a href=""http://my.kompas.com"" rel=""nofollow"">MyKompas</a>","kompascom",7,FALSE,FALSE,NA,NA
"375","BMW Seri 2 Active Tourer, Lebih dari Sekedar Mobil Keluarga http://t.co/b3CwEPSwTJ",FALSE,3,NA,2015-04-02 02:10:54,FALSE,NA,"583451509213507584",NA,"<a href=""http://my.kompas.com"" rel=""nofollow"">MyKompas</a>","kompascom",6,FALSE,FALSE,NA,NA
"376","Sterling Kepincut ""Godaan"" Arsenal http://t.co/fPCdMU6kH4",FALSE,4,NA,2015-04-02 02:06:45,FALSE,NA,"583450466966638595",NA,"<a href=""http://my.kompas.com"" rel=""nofollow"">MyKompas</a>","kompascom",11,FALSE,FALSE,NA,NA
"377","Meski Bisnis Properti Suram, Rumah Murah Tetap Diburu http://t.co/5oBxO1bGRU",FALSE,3,NA,2015-04-02 02:04:57,FALSE,NA,"583450013423935488",NA,"<a href=""http://my.kompas.com"" rel=""nofollow"">MyKompas</a>","kompascom",4,FALSE,FALSE,NA,NA
"378","Santap Sereal Bikin Panjang Umur http://t.co/r71QjgodZd",FALSE,4,NA,2015-04-02 02:04:47,FALSE,NA,"583449969685729280",NA,"<a href=""http://my.kompas.com"" rel=""nofollow"">MyKompas</a>","kompascom",10,FALSE,FALSE,NA,NA
"379","Pakai Parang Rampok 7 Sepeda Motor, Salomo Dibekuk http://t.co/ueD0naX40N",FALSE,2,NA,2015-04-02 02:02:58,FALSE,NA,"583449512741482496",NA,"<a href=""http://my.kompas.com"" rel=""nofollow"">MyKompas</a>","kompascom",5,FALSE,FALSE,NA,NA
"380","Gunakan Cara ""DPRD"", Ahok ""Crop"" Anggaran yang Dianggap Boros http://t.co/njlm5fKwrl",FALSE,2,NA,2015-04-02 02:02:48,FALSE,NA,"583449469015855105",NA,"<a href=""http://my.kompas.com"" rel=""nofollow"">MyKompas</a>","kompascom",4,FALSE,FALSE,NA,NA
"381","Golkar Dinilai Alami Disorientasi Politik http://t.co/uAFzsopFSO",FALSE,2,NA,2015-04-02 02:00:52,FALSE,NA,"583448985546854400",NA,"<a href=""http://my.kompas.com"" rel=""nofollow"">MyKompas</a>","kompascom",9,FALSE,FALSE,NA,NA
"382","Hakim Sarpin Tak Akan Penuhi Panggilan KY http://t.co/rwGxQh9NWr",FALSE,12,NA,2015-04-02 02:00:45,FALSE,NA,"583448956589350912",NA,"<a href=""http://my.kompas.com"" rel=""nofollow"">MyKompas</a>","kompascom",11,FALSE,FALSE,NA,NA
"383","Penurunan Produksi AS Hentikan Kenaikan Harga Minyak Dunia http://t.co/DAM4tUYNYp",FALSE,6,NA,2015-04-02 01:54:52,FALSE,NA,"583447474376810497",NA,"<a href=""http://my.kompas.com"" rel=""nofollow"">MyKompas</a>","kompascom",5,FALSE,FALSE,NA,NA
"384","Dalam Suasana Mencekam, 262 WNI Dievakuasi dari Yaman ke Arab Saudi http://t.co/sYWBANZWlV",FALSE,7,NA,2015-04-02 01:54:41,FALSE,NA,"583447429665521665",NA,"<a href=""http://my.kompas.com"" rel=""nofollow"">MyKompas</a>","kompascom",11,FALSE,FALSE,NA,NA
"385","Indikasi Penyegaran Avanza Menguat http://t.co/Y3Hyr8pU1x",FALSE,1,NA,2015-04-02 01:44:34,FALSE,NA,"583444881655242753",NA,"<a href=""http://my.kompas.com"" rel=""nofollow"">MyKompas</a>","kompascom",1,FALSE,FALSE,NA,NA
"386","Presiden Terpilih Nigeria Bertekad Kalahkan Boko Haram http://t.co/sQvLlcgg20",FALSE,3,NA,2015-04-02 01:42:32,FALSE,NA,"583444372563234816",NA,"<a href=""http://my.kompas.com"" rel=""nofollow"">MyKompas</a>","kompascom",6,FALSE,FALSE,NA,NA
"387","Naik Lagi, Harga Elpiji 12 Kg Jadi Rp 142.000 per Tabung http://t.co/MpzugHead4",FALSE,14,NA,2015-04-02 01:40:44,FALSE,NA,"583443919288958976",NA,"<a href=""http://my.kompas.com"" rel=""nofollow"">MyKompas</a>","kompascom",38,FALSE,FALSE,NA,NA
"388","Asyik ""Ngobrol"" saat Musrenbang, Apa yang Dibicarakan Taufik dan Ahok?  http://t.co/NZTv1pvx7p",FALSE,2,NA,2015-04-02 01:40:34,FALSE,NA,"583443875471032321",NA,"<a href=""http://my.kompas.com"" rel=""nofollow"">MyKompas</a>","kompascom",3,FALSE,FALSE,NA,NA
"389","Hari Ini, Denny Indrayana Kembali Jalani Pemeriksaan di Bareskrim Polri http://t.co/UB3IIyM4RC",FALSE,3,NA,2015-04-02 01:38:31,FALSE,NA,"583443359374553088",NA,"<a href=""http://my.kompas.com"" rel=""nofollow"">MyKompas</a>","kompascom",6,FALSE,FALSE,NA,NA
"390","Mourinho Peringatkan Diego Costa dkk http://t.co/lnKtBBJTmV",FALSE,4,NA,2015-04-02 01:36:33,FALSE,NA,"583442865293959170",NA,"<a href=""http://my.kompas.com"" rel=""nofollow"">MyKompas</a>","kompascom",6,FALSE,FALSE,NA,NA
"391","Rebutan Tempat Duduk, Penumpang KRL Tersungkur di Lantai Kereta http://t.co/JKj433HvcK",FALSE,2,NA,2015-04-02 01:26:26,FALSE,NA,"583440317128388608",NA,"<a href=""http://my.kompas.com"" rel=""nofollow"">MyKompas</a>","kompascom",9,FALSE,FALSE,NA,NA
"392","Lucas Leiva ""Gatal"" Main Lawan Arsenal http://t.co/imUj1I0aJz",FALSE,3,NA,2015-04-02 01:10:28,FALSE,NA,"583436302806155264",NA,"<a href=""http://my.kompas.com"" rel=""nofollow"">MyKompas</a>","kompascom",5,FALSE,FALSE,NA,NA
"393","Gubernur NTT: Promosi Pariwisata Masih Tertinggal http://t.co/jpmIEVSIe0",FALSE,1,NA,2015-04-02 01:10:18,FALSE,NA,"583436259067953153",NA,"<a href=""http://my.kompas.com"" rel=""nofollow"">MyKompas</a>","kompascom",12,FALSE,FALSE,NA,NA
"394","Komunitas Captiva Ingin ""Keluarga"" Seperti Furious 7 http://t.co/3LjoT9gyFJ",FALSE,1,NA,2015-04-02 01:06:26,FALSE,NA,"583435283967840256",NA,"<a href=""http://my.kompas.com"" rel=""nofollow"">MyKompas</a>","kompascom",3,FALSE,FALSE,NA,NA
"395","Agung Laksono: Saya Tetap Memimpin Golkar http://t.co/Bli1m2sW2V",FALSE,10,NA,2015-04-02 01:04:16,FALSE,NA,"583434738876030977",NA,"<a href=""http://my.kompas.com"" rel=""nofollow"">MyKompas</a>","kompascom",10,FALSE,FALSE,NA,NA
"396","Harga Mobil Murah Toyota Naik Lagi? http://t.co/zwX3r4lb3K",FALSE,3,NA,2015-04-02 01:00:12,FALSE,NA,"583433716703170561",NA,"<a href=""http://my.kompas.com"" rel=""nofollow"">MyKompas</a>","kompascom",7,FALSE,FALSE,NA,NA
"397","NSA Bakal Hentikan Program Penyadapan? http://t.co/YLMysTxg5W.",FALSE,3,NA,2015-04-02 00:52:08,FALSE,NA,"583431686169337857",NA,"<a href=""http://my.kompas.com"" rel=""nofollow"">MyKompas</a>","kompascom",3,FALSE,FALSE,NA,NA
"398","Giroud Ingin Lampaui Sanchez  http://t.co/iCSvijrwJk.",FALSE,5,NA,2015-04-02 00:38:02,FALSE,NA,"583428138631213058",NA,"<a href=""http://my.kompas.com"" rel=""nofollow"">MyKompas</a>","kompascom",7,FALSE,FALSE,NA,NA
"399","KPK: Penetapan Tersangka Bukan di Akhir Penyidikan http://t.co/o0mFrH0Y4p",FALSE,2,NA,2015-04-02 00:29:57,FALSE,NA,"583426104708304896",NA,"<a href=""http://my.kompas.com"" rel=""nofollow"">MyKompas</a>","kompascom",3,FALSE,FALSE,NA,NA
"400","Lampaui Obama, Pendapatan PM Singapura Tertinggi di Dunia http://t.co/pCGjfiKQY0",FALSE,5,NA,2015-04-02 00:27:56,FALSE,NA,"583425598753644544",NA,"<a href=""http://my.kompas.com"" rel=""nofollow"">MyKompas</a>","kompascom",9,FALSE,FALSE,NA,NA
"401","Pengamat Kepolisian Ungkap Alasan Polisi Sering Jadi Korban ""Bully"" di Medsos http://t.co/38DFFQKjFk.",FALSE,5,NA,2015-04-02 00:26:09,FALSE,NA,"583425146284716032",NA,"<a href=""http://my.kompas.com"" rel=""nofollow"">MyKompas</a>","kompascom",12,FALSE,FALSE,NA,NA
"402","Apple Terima Tukar Tambah BlackBerry, Android, dan Windows Phone http://t.co/HZ4chU6mtd",FALSE,27,NA,2015-04-02 00:25:58,FALSE,NA,"583425102588444673",NA,"<a href=""http://my.kompas.com"" rel=""nofollow"">MyKompas</a>","kompascom",36,FALSE,FALSE,NA,NA
"403","Pique Yakin Messi Fit Lawan Celta Vigo http://t.co/FkolGSPnye",FALSE,3,NA,2015-04-02 00:24:07,FALSE,NA,"583424635733057536",NA,"<a href=""http://my.kompas.com"" rel=""nofollow"">MyKompas</a>","kompascom",3,FALSE,FALSE,NA,NA
"404","Diabetes, Waspadai Luka di Bagian Kaki http://t.co/3liR2JImYs",FALSE,3,NA,2015-04-02 00:23:56,FALSE,NA,"583424591227301888",NA,"<a href=""http://my.kompas.com"" rel=""nofollow"">MyKompas</a>","kompascom",13,FALSE,FALSE,NA,NA
"405","Sering Beri Kritik, Bukti Warga Cintai Polisi http://t.co/1RvkiuuQHd",FALSE,2,NA,2015-04-02 00:19:52,FALSE,NA,"583423565510213632",NA,"<a href=""http://my.kompas.com"" rel=""nofollow"">MyKompas</a>","kompascom",5,FALSE,FALSE,NA,NA
"406","Beckham Intip Kencan Pertama Anak Sulungnya http://t.co/imHIKAcZlQ",FALSE,8,NA,2015-04-02 00:13:48,FALSE,NA,"583422042101252096",NA,"<a href=""http://my.kompas.com"" rel=""nofollow"">MyKompas</a>","kompascom",10,FALSE,FALSE,NA,NA
"407","Pemerintah Kembalikan Sistem Tender ke Pengumuman di Koran http://t.co/R6x5Bizru5",FALSE,4,NA,2015-04-02 00:11:47,FALSE,NA,"583421534703722497",NA,"<a href=""http://my.kompas.com"" rel=""nofollow"">MyKompas</a>","kompascom",7,FALSE,FALSE,NA,NA
"408","Tanya Atep 3: Atep Ingin Bobotoh dan The Jakmania Berdamai http://t.co/38fn51K6Qt",FALSE,7,NA,2015-04-02 00:09:47,FALSE,NA,"583421031039119360",NA,"<a href=""http://my.kompas.com"" rel=""nofollow"">MyKompas</a>","kompascom",8,FALSE,FALSE,NA,NA
"409","Para Pensiunan Picu Lonjakan Transaksi Properti Inggris http://t.co/3DmHHVGsub",FALSE,4,NA,2015-04-02 00:06:12,FALSE,NA,"583420126961115136",NA,"<a href=""http://my.kompas.com"" rel=""nofollow"">MyKompas</a>","kompascom",3,FALSE,FALSE,NA,NA
"410","Faisal Basri: Wapres ""Ngomong"" Beda, Presiden ""Ngomong"" Beda http://t.co/MSogmbn1He",FALSE,5,NA,2015-04-02 00:06:01,FALSE,NA,"583420083143180288",NA,"<a href=""http://my.kompas.com"" rel=""nofollow"">MyKompas</a>","kompascom",37,FALSE,FALSE,NA,NA
"411","Hari Ini, Kemendagri Undang Ahok dan DPRD DKI Samakan Persepsi APBD 2015 http://t.co/SQ1C45pTWf",FALSE,5,NA,2015-04-02 00:05:51,FALSE,NA,"583420039476281344",NA,"<a href=""http://my.kompas.com"" rel=""nofollow"">MyKompas</a>","kompascom",6,FALSE,FALSE,NA,NA
"412","Gangguan Sinyal Pagi Ini, KRL Dari Bogor Tak Kunjung Datang http://t.co/9BpOLh3UhF",FALSE,3,NA,2015-04-02 00:03:44,FALSE,NA,"583419505205874689",NA,"<a href=""http://my.kompas.com"" rel=""nofollow"">MyKompas</a>","kompascom",18,FALSE,FALSE,NA,NA
"413","YLKI: Rakyat Terbebani Saat Harga BBM Dilepas ke Pasar http://t.co/Tlo9rH5o8T",FALSE,8,NA,2015-04-01 23:53:39,FALSE,NA,"583416968381739010",NA,"<a href=""http://my.kompas.com"" rel=""nofollow"">MyKompas</a>","kompascom",12,FALSE,FALSE,NA,NA
