"","text","favorited","favoriteCount","replyToSN","created","truncated","replyToSID","id","replyToUID","statusSource","screenName","retweetCount","isRetweet","retweeted","longitude","latitude"
"207","Konflik Golkar Tak Akan Dibahas di Rapat Paripurna DPR http://t.co/OoCqFnxJdB",FALSE,3,NA,2015-04-02 08:06:48,FALSE,NA,"583541076427874304",NA,"<a href=""http://my.kompas.com"" rel=""nofollow"">MyKompas</a>","kompascom",5,FALSE,FALSE,NA,NA
"208","Penampilan Terbaik dari Generasi Baru Lexus RX http://t.co/VdGzNoaxkP",FALSE,2,NA,2015-04-02 08:06:38,FALSE,NA,"583541032161153024",NA,"<a href=""http://my.kompas.com"" rel=""nofollow"">MyKompas</a>","kompascom",3,FALSE,FALSE,NA,NA
"209","Tubuh Aktris Tara Reid, Mulai Mengkhawatirkan http://t.co/Fcbm6OjRCs",FALSE,4,NA,2015-04-02 08:06:27,FALSE,NA,"583540988011917313",NA,"<a href=""http://my.kompas.com"" rel=""nofollow"">MyKompas</a>","kompascom",3,FALSE,FALSE,NA,NA
"210","Pergantian Musim, Waspadai Influenza http://t.co/8akfw9Gjro",FALSE,3,NA,2015-04-02 08:06:17,FALSE,NA,"583540944265326593",NA,"<a href=""http://my.kompas.com"" rel=""nofollow"">MyKompas</a>","kompascom",8,FALSE,FALSE,NA,NA
"211","Aher: Persiapan KAA Aman dan Lancar http://t.co/RAHU7rnGtY",FALSE,1,NA,2015-04-02 08:06:07,FALSE,NA,"583540900497788928",NA,"<a href=""http://my.kompas.com"" rel=""nofollow"">MyKompas</a>","kompascom",1,FALSE,FALSE,NA,NA
"212","Akbar Faizal Sempat Curiga Kenaikan Uang Muka Mobil untuk Pejabat ""Hoax"" http://t.co/ZdiSM6wZti",FALSE,2,NA,2015-04-02 08:03:52,FALSE,NA,"583540337475321856",NA,"<a href=""http://my.kompas.com"" rel=""nofollow"">MyKompas</a>","kompascom",5,FALSE,FALSE,NA,NA
"213","Polda Metro: Pesan Berantai soal Pesta Ganja di Senayan Hoax http://t.co/J9rfTriFvk",FALSE,0,NA,2015-04-02 07:57:49,FALSE,NA,"583538813755985920",NA,"<a href=""http://my.kompas.com"" rel=""nofollow"">MyKompas</a>","kompascom",4,FALSE,FALSE,NA,NA
"214","Geledah Bekas Ruangan Denny Indrayana, Polisi Sita 299 Benda http://t.co/lZFd54gDTy",FALSE,0,NA,2015-04-02 07:53:53,FALSE,NA,"583537823745093632",NA,"<a href=""http://my.kompas.com"" rel=""nofollow"">MyKompas</a>","kompascom",3,FALSE,FALSE,NA,NA
"215","Ingin Selamatkan Tas Sekolah, Bocah 6 Tahun Tewas dalam Kebakaran http://t.co/dLBeOSd2Ld",FALSE,0,NA,2015-04-02 07:53:43,FALSE,NA,"583537780044627968",NA,"<a href=""http://my.kompas.com"" rel=""nofollow"">MyKompas</a>","kompascom",3,FALSE,FALSE,NA,NA
"216","Ketika Ahok dan Ketua DPRD Diminta Berpelukan http://t.co/ROOR85jUZg",FALSE,3,NA,2015-04-02 07:49:38,FALSE,NA,"583536755279699969",NA,"<a href=""http://my.kompas.com"" rel=""nofollow"">MyKompas</a>","kompascom",6,FALSE,FALSE,NA,NA
"217","Denny Indrayana Mengaku KPK Beri Catatan untuk ""Payment Gateway"" http://t.co/UyabFhie5f",FALSE,2,NA,2015-04-02 07:47:37,FALSE,NA,"583536248809062400",NA,"<a href=""http://my.kompas.com"" rel=""nofollow"">MyKompas</a>","kompascom",2,FALSE,FALSE,NA,NA
"218","Jadwal Sidang Paripurna Mundur, Tim Angket Bantah Hasil Penyelidikan Belum Siap  http://t.co/2p2cIImCaV",FALSE,4,NA,2015-04-02 07:45:52,FALSE,NA,"583535807899672576",NA,"<a href=""http://my.kompas.com"" rel=""nofollow"">MyKompas</a>","kompascom",4,FALSE,FALSE,NA,NA
"219","Romahurmuziy Sarankan Jokowi Batalkan Kenaikan Uang Muka Mobil Pejabat http://t.co/Y2JzzHagss",FALSE,2,NA,2015-04-02 07:45:42,FALSE,NA,"583535763930742784",NA,"<a href=""http://my.kompas.com"" rel=""nofollow"">MyKompas</a>","kompascom",6,FALSE,FALSE,NA,NA
"220","Sony Janji Xperia 4G Pakai Komponen Lokal http://t.co/5Vp3NZgxhK",FALSE,2,NA,2015-04-02 07:39:39,FALSE,NA,"583534240731508736",NA,"<a href=""http://my.kompas.com"" rel=""nofollow"">MyKompas</a>","kompascom",8,FALSE,FALSE,NA,NA
"221","Malam Ini, Satu Pesawat TNI AU Diterbangkan ke Yaman untuk Evakuasi WNI http://t.co/vZJYPt4ZS8",FALSE,5,NA,2015-04-02 07:37:32,FALSE,NA,"583533709703262208",NA,"<a href=""http://my.kompas.com"" rel=""nofollow"">MyKompas</a>","kompascom",8,FALSE,FALSE,NA,NA
"222","Diskominfo Kaltim Bantah Punya Utang ke Telkomsel http://t.co/GtpIwc8sBy",FALSE,5,NA,2015-04-02 07:35:32,FALSE,NA,"583533207393447936",NA,"<a href=""http://my.kompas.com"" rel=""nofollow"">MyKompas</a>","kompascom",3,FALSE,FALSE,NA,NA
"223","Cerita di Balik Penunjukan Lima Deputi Luhut Binsar Panjaitan http://t.co/HWELkYbGPi",FALSE,1,NA,2015-04-02 07:29:43,FALSE,NA,"583531743598116865",NA,"<a href=""http://my.kompas.com"" rel=""nofollow"">MyKompas</a>","kompascom",4,FALSE,FALSE,NA,NA
"224","Indah Nevertari: Dari Christina Aguilera sampai Agnez Mo  http://t.co/SwpAQHr1tj",FALSE,8,NA,2015-04-02 07:29:33,FALSE,NA,"583531699645980672",NA,"<a href=""http://my.kompas.com"" rel=""nofollow"">MyKompas</a>","kompascom",7,FALSE,FALSE,NA,NA
"225","Kemendagri: Kenapa Pak Ahok Masih Targetkan Pendapatan dari Miras?  http://t.co/iw8PqWLklz",FALSE,3,NA,2015-04-02 07:27:28,FALSE,NA,"583531177849397249",NA,"<a href=""http://my.kompas.com"" rel=""nofollow"">MyKompas</a>","kompascom",12,FALSE,FALSE,NA,NA
"226","Mau Tahu yang Tidak Disukai Turis Tiongkok di Bali? http://t.co/XOlvdHUioZ",FALSE,10,NA,2015-04-02 07:23:25,FALSE,NA,"583530156322496512",NA,"<a href=""http://my.kompas.com"" rel=""nofollow"">MyKompas</a>","kompascom",4,FALSE,FALSE,NA,NA
"227","Menkeu  Enggak ""Ngerti"" soal Kenaikan Tunjangan Mobil Pejabat http://t.co/t2rJKKy8Hs",FALSE,3,NA,2015-04-02 07:19:24,FALSE,NA,"583529145121972225",NA,"<a href=""http://my.kompas.com"" rel=""nofollow"">MyKompas</a>","kompascom",8,FALSE,FALSE,NA,NA
"228","Mengaku Bisa Gandakan Uang, Pria Ini Diringkus Saat Lakukan Ritual http://t.co/f3yr6YgDaN",FALSE,0,NA,2015-04-02 07:15:48,FALSE,NA,"583528241253580800",NA,"<a href=""http://my.kompas.com"" rel=""nofollow"">MyKompas</a>","kompascom",3,FALSE,FALSE,NA,NA
"229","Ini Tanggapan Nissan Tentang Pikap Mercy Berbasis Navara  http://t.co/qUBj02K2YX",FALSE,2,NA,2015-04-02 07:15:38,FALSE,NA,"583528197565722625",NA,"<a href=""http://my.kompas.com"" rel=""nofollow"">MyKompas</a>","kompascom",1,FALSE,FALSE,NA,NA
"230","Pandangi Alat Berat Ratakan Rumahnya, Bocah-bocah Menahan Tangis http://t.co/7mSoXxOZX7",FALSE,2,NA,2015-04-02 07:15:27,FALSE,NA,"583528153840132096",NA,"<a href=""http://my.kompas.com"" rel=""nofollow"">MyKompas</a>","kompascom",1,FALSE,FALSE,NA,NA
"231","Bareskrim Bidik 2 Orang yang Diduga Terlibat Pemalsuan Dokumen Munas Golkar http://t.co/Jtk10RUQ4q",FALSE,1,NA,2015-04-02 07:13:27,FALSE,NA,"583527647059148800",NA,"<a href=""http://my.kompas.com"" rel=""nofollow"">MyKompas</a>","kompascom",7,FALSE,FALSE,NA,NA
"232","Datangi Bareskrim, Denny Indrayana Bilang Ini Hari Baik http://t.co/hhLXV6jtOH",FALSE,0,NA,2015-04-02 07:09:10,FALSE,NA,"583526570301632512",NA,"<a href=""http://my.kompas.com"" rel=""nofollow"">MyKompas</a>","kompascom",5,FALSE,FALSE,NA,NA
"233","Nedved Ungkap Ketertarikan Barcelona kepada Pogba http://t.co/GU4sFI7pdL",FALSE,2,NA,2015-04-02 07:07:32,FALSE,NA,"583526160144838656",NA,"<a href=""http://my.kompas.com"" rel=""nofollow"">MyKompas</a>","kompascom",5,FALSE,FALSE,NA,NA
"234","Pertamina: Harusnya Tidak Ribut http://t.co/AzAqhapWoZ",FALSE,1,NA,2015-04-02 07:07:22,FALSE,NA,"583526116423405568",NA,"<a href=""http://my.kompas.com"" rel=""nofollow"">MyKompas</a>","kompascom",6,FALSE,FALSE,NA,NA
"235","Kisah Lima Wanita Paling Subur di Dunia  http://t.co/VonvYHIrdj.",FALSE,3,NA,2015-04-02 07:05:47,FALSE,NA,"583525719013097472",NA,"<a href=""http://my.kompas.com"" rel=""nofollow"">MyKompas</a>","kompascom",7,FALSE,FALSE,NA,NA
"236","Latihan Kaki untuk Kebugaran Tubuh Menyeluruh  http://t.co/PSQV3lfDLy",FALSE,2,NA,2015-04-02 07:05:36,FALSE,NA,"583525675048402944",NA,"<a href=""http://my.kompas.com"" rel=""nofollow"">MyKompas</a>","kompascom",8,FALSE,FALSE,NA,NA
"237","Tiga Deputi Luhut Juga Jadi Juru Bicara Presiden http://t.co/q5V1wQNatq",FALSE,2,NA,2015-04-02 07:05:26,FALSE,NA,"583525631293427712",NA,"<a href=""http://my.kompas.com"" rel=""nofollow"">MyKompas</a>","kompascom",4,FALSE,FALSE,NA,NA
"238","Bikin Arisan Bodong, Desainer Hengki Kawilarang Ditangkap http://t.co/4fryX6hcLj",FALSE,4,NA,2015-04-02 06:55:11,FALSE,NA,"583523052719222785",NA,"<a href=""http://my.kompas.com"" rel=""nofollow"">MyKompas</a>","kompascom",5,FALSE,FALSE,NA,NA
"239","Warga Srengseng Tak Tahu Ada Agen  Zamzam Palsu di Wilayahnya  http://t.co/tv8HTPnyNX",FALSE,3,NA,2015-04-02 06:53:36,FALSE,NA,"583522653920600064",NA,"<a href=""http://my.kompas.com"" rel=""nofollow"">MyKompas</a>","kompascom",4,FALSE,FALSE,NA,NA
"240","Shae: Ini Menyebalkan, Seru, dan Aneh http://t.co/YE9m0ZT1OT",FALSE,0,NA,2015-04-02 06:53:26,FALSE,NA,"583522610144612352",NA,"<a href=""http://my.kompas.com"" rel=""nofollow"">MyKompas</a>","kompascom",1,FALSE,FALSE,NA,NA
"241","Membandingkan Redmi 2 dengan Android One dan Lenovo A6000 http://t.co/cmbGkMIOql",FALSE,4,NA,2015-04-02 06:53:15,FALSE,NA,"583522566364463104",NA,"<a href=""http://my.kompas.com"" rel=""nofollow"">MyKompas</a>","kompascom",8,FALSE,FALSE,NA,NA
"242","Naik Bemo dan Mobil James Bond http://t.co/2za7bSh0Yj",FALSE,1,NA,2015-04-02 06:51:22,FALSE,NA,"583522090696876033",NA,"<a href=""http://my.kompas.com"" rel=""nofollow"">MyKompas</a>","kompascom",3,FALSE,FALSE,NA,NA
"243","Sosok Baru Chevrolet Spark yang Makin Dewasa http://t.co/lrFt19cFkZ",FALSE,0,NA,2015-04-02 06:51:11,FALSE,NA,"583522046841200640",NA,"<a href=""http://my.kompas.com"" rel=""nofollow"">MyKompas</a>","kompascom",3,FALSE,FALSE,NA,NA
"244","Denny Indrayana Penuhi Panggilan Lanjutan di Bareskrim Polri http://t.co/2Af2d4DvHb",FALSE,1,NA,2015-04-02 06:49:08,FALSE,NA,"583521530698575873",NA,"<a href=""http://my.kompas.com"" rel=""nofollow"">MyKompas</a>","kompascom",3,FALSE,FALSE,NA,NA
"245","Bagi Shae, Kualitas Vokal Anggun C Sasmi di Atas Lady Gaga  http://t.co/Xy7QGvHWJV",FALSE,10,NA,2015-04-02 06:32:49,FALSE,NA,"583517424063942656",NA,"<a href=""http://my.kompas.com"" rel=""nofollow"">MyKompas</a>","kompascom",18,FALSE,FALSE,NA,NA
"246","Anggota DPR Anggap Wajar Kenaikan Uang Muka Pembelian Mobil Pejabat http://t.co/Np4Csc1R2V",FALSE,6,NA,2015-04-02 06:31:00,FALSE,NA,"583516965160910848",NA,"<a href=""http://my.kompas.com"" rel=""nofollow"">MyKompas</a>","kompascom",10,FALSE,FALSE,NA,NA
"247","Kemendagri Pertanyakan Target Pendapatan DKI dari Pajak Hiburan Hanya Rp 1 T http://t.co/qQ32gkC3kw",FALSE,2,NA,2015-04-02 06:28:58,FALSE,NA,"583516453497741312",NA,"<a href=""http://my.kompas.com"" rel=""nofollow"">MyKompas</a>","kompascom",8,FALSE,FALSE,NA,NA
"248","Diprotes Soal Cabut Tiang Bendera, Ini Jawaban Ridwan Kamil http://t.co/Jcvch2cOXA",FALSE,6,NA,2015-04-02 06:27:20,FALSE,NA,"583516043470970880",NA,"<a href=""http://my.kompas.com"" rel=""nofollow"">MyKompas</a>","kompascom",7,FALSE,FALSE,NA,NA
"249","Anggota Brimob Aniaya Warga, Polisi Turunkan Tim Khusus http://t.co/WuN0nL4COF",FALSE,6,NA,2015-04-02 06:27:10,FALSE,NA,"583515999170768897",NA,"<a href=""http://my.kompas.com"" rel=""nofollow"">MyKompas</a>","kompascom",4,FALSE,FALSE,NA,NA
"250","Hamzah Haz Minta Salah Satu Kubu PPP Harus Mengalah http://t.co/z1Zh5QHxQJ",FALSE,3,NA,2015-04-02 06:26:59,FALSE,NA,"583515953930964992",NA,"<a href=""http://my.kompas.com"" rel=""nofollow"">MyKompas</a>","kompascom",3,FALSE,FALSE,NA,NA
"251","Sejarah Gedung Parlemen yang Jarang Terungkap http://t.co/TuC1waEcoJ",FALSE,3,NA,2015-04-02 06:25:08,FALSE,NA,"583515488984014848",NA,"<a href=""http://my.kompas.com"" rel=""nofollow"">MyKompas</a>","kompascom",2,FALSE,FALSE,NA,NA
"252","Mantan Sekretaris Komisi E Tegaskan Tidak Terlibat Pengadaan UPS  http://t.co/uWPZRM1ArT",FALSE,3,NA,2015-04-02 06:24:57,FALSE,NA,"583515444981571584",NA,"<a href=""http://my.kompas.com"" rel=""nofollow"">MyKompas</a>","kompascom",1,FALSE,FALSE,NA,NA
"253","CEO Sony Mobile Tanggapi ""Tudingan"" Contek Xiaomi http://t.co/dH6DGzIgZX",FALSE,1,NA,2015-04-02 06:18:52,FALSE,NA,"583513910982139904",NA,"<a href=""http://my.kompas.com"" rel=""nofollow"">MyKompas</a>","kompascom",9,FALSE,FALSE,NA,NA
"254","Hakim Tegur Saksi Ahli Suryadharma Ali http://t.co/3DkI8WeZVs",FALSE,3,NA,2015-04-02 06:17:02,FALSE,NA,"583513449222676480",NA,"<a href=""http://my.kompas.com"" rel=""nofollow"">MyKompas</a>","kompascom",2,FALSE,FALSE,NA,NA
"255","Nissan Pasang Target Realistis untuk All-New Navara http://t.co/G7OtyTn680",FALSE,1,NA,2015-04-02 06:16:51,FALSE,NA,"583513405241233408",NA,"<a href=""http://my.kompas.com"" rel=""nofollow"">MyKompas</a>","kompascom",4,FALSE,FALSE,NA,NA
"256","Bayi Kembar Ini Lahir Selang 24 Hari  http://t.co/4CwmpRjtT5.",FALSE,1,NA,2015-04-02 06:15:01,FALSE,NA,"583512942517194752",NA,"<a href=""http://my.kompas.com"" rel=""nofollow"">MyKompas</a>","kompascom",6,FALSE,FALSE,NA,NA
"257","Ketua DPRD: Pengesahan APBD 2015 Tetap Pakai Pergub http://t.co/2iSEEfhQc2",FALSE,2,NA,2015-04-02 06:14:50,FALSE,NA,"583512898707660800",NA,"<a href=""http://my.kompas.com"" rel=""nofollow"">MyKompas</a>","kompascom",6,FALSE,FALSE,NA,NA
"258","Menkeu Minta Pejabat Baru Bisa Penuhi Target Penerimaan Pajak 2015 http://t.co/rh29ZleddS",FALSE,2,NA,2015-04-02 06:10:54,FALSE,NA,"583511907350384640",NA,"<a href=""http://my.kompas.com"" rel=""nofollow"">MyKompas</a>","kompascom",4,FALSE,FALSE,NA,NA
"259","Hamzah Haz Sarankan Penggunaan Hak Angket Tidak Buang Energi http://t.co/Dh1xNEzDe7",FALSE,0,NA,2015-04-02 06:09:02,FALSE,NA,"583511438443937793",NA,"<a href=""http://my.kompas.com"" rel=""nofollow"">MyKompas</a>","kompascom",5,FALSE,FALSE,NA,NA
"260","Ridwan Kamil Pindah Tiang Bendera Gedung KAA, Pelaku Sejarah Tersinggung  http://t.co/OC2xh6lW6l",FALSE,6,NA,2015-04-02 06:08:50,FALSE,NA,"583511388984750080",NA,"<a href=""http://my.kompas.com"" rel=""nofollow"">MyKompas</a>","kompascom",5,FALSE,FALSE,NA,NA
"261","Klub Argentina Siap Tampung Radamel Falcao http://t.co/8TXZRRT9JB",FALSE,0,NA,2015-04-02 06:06:50,FALSE,NA,"583510883411853312",NA,"<a href=""http://my.kompas.com"" rel=""nofollow"">MyKompas</a>","kompascom",3,FALSE,FALSE,NA,NA
"262","Toko Buah Itu Digerebek Polisi karena Air Zam-zam Palsu http://t.co/fAuiJD39Uy",FALSE,2,NA,2015-04-02 06:05:13,FALSE,NA,"583510478644617216",NA,"<a href=""http://my.kompas.com"" rel=""nofollow"">MyKompas</a>","kompascom",4,FALSE,FALSE,NA,NA
"263","Wow, Amanda Seyfried Kenakan Sandal Seharga 11 Juta! http://t.co/0Fduk0bXiA",FALSE,2,NA,2015-04-02 06:05:03,FALSE,NA,"583510434092724225",NA,"<a href=""http://my.kompas.com"" rel=""nofollow"">MyKompas</a>","kompascom",2,FALSE,FALSE,NA,NA
"264","Bagaimana Fungsi Testis Anak Setelah Operasi akibat Radang? http://t.co/3QZewbivie.",FALSE,3,NA,2015-04-02 06:04:49,FALSE,NA,"583510377486422017",NA,"<a href=""http://my.kompas.com"" rel=""nofollow"">MyKompas</a>","kompascom",2,FALSE,FALSE,NA,NA
"265","Tiga Pembunuhan Terjadi dalam Sehari, Ada yang Berubah dari Perilaku Masyarakat http://t.co/wPmKtT5aSu",FALSE,2,NA,2015-04-02 06:02:47,FALSE,NA,"583509865282211840",NA,"<a href=""http://my.kompas.com"" rel=""nofollow"">MyKompas</a>","kompascom",10,FALSE,FALSE,NA,NA
"266","Kubu Aburizal Sampaikan Putusan Sela PTUN kepada Pimpinan DPR http://t.co/lrLCo8oCwY",FALSE,0,NA,2015-04-02 06:00:35,FALSE,NA,"583509309318803456",NA,"<a href=""http://my.kompas.com"" rel=""nofollow"">MyKompas</a>","kompascom",2,FALSE,FALSE,NA,NA
"267","Garuda Tambah Kepemilikan Saham di Citilink http://t.co/Sn3ecpRkkd",FALSE,4,NA,2015-04-02 05:58:52,FALSE,NA,"583508879268421634",NA,"<a href=""http://my.kompas.com"" rel=""nofollow"">MyKompas</a>","kompascom",3,FALSE,FALSE,NA,NA
"268","Mencari Juara Tunggal Putra Baru di Malaysia Terbuka http://t.co/CLVvPD63Vi",FALSE,2,NA,2015-04-02 05:58:42,FALSE,NA,"583508835551182848",NA,"<a href=""http://my.kompas.com"" rel=""nofollow"">MyKompas</a>","kompascom",4,FALSE,FALSE,NA,NA
"269","Pemenang ""Football is Great"" Diumumkan usai Sunderland Vs Newcastle http://t.co/c6RnShreLD",FALSE,4,NA,2015-04-02 05:56:42,FALSE,NA,"583508335145521154",NA,"<a href=""http://my.kompas.com"" rel=""nofollow"">MyKompas</a>","kompascom",3,FALSE,FALSE,NA,NA
"270","Hakim Sarpin Anggap KY Tak Berwenang Periksa Materi Putusannya http://t.co/u9YgUj5irT",FALSE,3,NA,2015-04-02 05:54:40,FALSE,NA,"583507823457239041",NA,"<a href=""http://my.kompas.com"" rel=""nofollow"">MyKompas</a>","kompascom",4,FALSE,FALSE,NA,NA
"271","Taufik: Kalau Kita Datang Artinya APBD Disahkan Pakai Perda http://t.co/PKzGpruEhJ",FALSE,2,NA,2015-04-02 05:50:37,FALSE,NA,"583506803876499456",NA,"<a href=""http://my.kompas.com"" rel=""nofollow"">MyKompas</a>","kompascom",2,FALSE,FALSE,NA,NA
"272","Soal Polwan Berjilbab, F-PKS Berterima Kasih kepada Badrodin  http://t.co/WkUhY7uG2f",FALSE,3,NA,2015-04-02 05:46:48,FALSE,NA,"583505843510849536",NA,"<a href=""http://my.kompas.com"" rel=""nofollow"">MyKompas</a>","kompascom",8,FALSE,FALSE,NA,NA
"273","Apple Watch Diprediksi Laku Keras http://t.co/8GuiQWGKnP",FALSE,2,NA,2015-04-02 05:46:38,FALSE,NA,"583505799042867201",NA,"<a href=""http://my.kompas.com"" rel=""nofollow"">MyKompas</a>","kompascom",2,FALSE,FALSE,NA,NA
"274","Ketua Komisi XI DPR Kritik Jokowi soal Kenaikan Uang Muka Mobil Pejabat http://t.co/AYhiPc4E1K",FALSE,3,NA,2015-04-02 05:42:51,FALSE,NA,"583504849880223744",NA,"<a href=""http://my.kompas.com"" rel=""nofollow"">MyKompas</a>","kompascom",2,FALSE,FALSE,NA,NA
"275","Sidang Putusan JIS Dipenuhi Pendukung Berbaju Putih http://t.co/QsTHoJIe3J",FALSE,0,NA,2015-04-02 05:42:41,FALSE,NA,"583504806204968960",NA,"<a href=""http://my.kompas.com"" rel=""nofollow"">MyKompas</a>","kompascom",2,FALSE,FALSE,NA,NA
"276","Ridwan Kamil Tanggapi Santai Kritik Deddy Mizwar http://t.co/u9x1oYiQ14",FALSE,8,NA,2015-04-02 05:42:30,FALSE,NA,"583504761913085952",NA,"<a href=""http://my.kompas.com"" rel=""nofollow"">MyKompas</a>","kompascom",5,FALSE,FALSE,NA,NA
"277","Belum Genap Sebulan Bebas, Maling Ini Sudah 4 Kali Beraksi http://t.co/NwoMLi3J3d",FALSE,1,NA,2015-04-02 05:41:22,FALSE,NA,"583504474951430144",NA,"<a href=""http://my.kompas.com"" rel=""nofollow"">MyKompas</a>","kompascom",2,FALSE,FALSE,NA,NA
"278","Luhut: Saya Loyal kepada Presiden, Kecuali Presiden Langgar Konstitusi http://t.co/3mmuu84OmB",FALSE,4,NA,2015-04-02 05:41:12,FALSE,NA,"583504431229964288",NA,"<a href=""http://my.kompas.com"" rel=""nofollow"">MyKompas</a>","kompascom",4,FALSE,FALSE,NA,NA
"279","Bek Chelsea Bantah Rumor Kembali ke Atletico http://t.co/BTnMvVqZBN",FALSE,1,NA,2015-04-02 05:41:01,FALSE,NA,"583504387491766272",NA,"<a href=""http://my.kompas.com"" rel=""nofollow"">MyKompas</a>","kompascom",4,FALSE,FALSE,NA,NA
"280","Wapres Putuskan Proyek Pelabuhan Cilamaya Batal http://t.co/QgLDmMabkg",FALSE,3,NA,2015-04-02 05:40:51,FALSE,NA,"583504343720009729",NA,"<a href=""http://my.kompas.com"" rel=""nofollow"">MyKompas</a>","kompascom",4,FALSE,FALSE,NA,NA
"281","""Lihat Tuh Wajah Pejabat Lesu, Kebayang Gaji Rp 75 Juta tapi Gak Jadi"" http://t.co/3flDIKOOb6 http://t.co/l3xMykdXJq",FALSE,18,NA,2015-04-02 05:40:15,FALSE,NA,"583504192267886593",NA,"<a href=""http://twitter.com"" rel=""nofollow"">Twitter Web Client</a>","kompascom",25,FALSE,FALSE,NA,NA
"282","Kemendagri Soroti RAPBD DKI 2015 Tak Berpihak ke Rakyat http://t.co/WuqhKZO7Ws",FALSE,1,NA,2015-04-02 05:38:35,FALSE,NA,"583503776281038848",NA,"<a href=""http://my.kompas.com"" rel=""nofollow"">MyKompas</a>","kompascom",5,FALSE,FALSE,NA,NA
"283","Nissan All-New Navara Resmi Meluncur, Ini Harganya... http://t.co/sZrNGpFZmk",FALSE,4,NA,2015-04-02 05:36:23,FALSE,NA,"583503221861191680",NA,"<a href=""http://my.kompas.com"" rel=""nofollow"">MyKompas</a>","kompascom",6,FALSE,FALSE,NA,NA
"284","Waspadai Buah-buahan “Berkosmetik”    http://t.co/ly49dugrvl",FALSE,4,NA,2015-04-02 05:34:42,FALSE,NA,"583502796168638464",NA,"<a href=""http://my.kompas.com"" rel=""nofollow"">MyKompas</a>","kompascom",8,FALSE,FALSE,NA,NA
"285","Hati-hati, Banyak Air Zamzam Palsu http://t.co/OVphNzPefK",FALSE,1,NA,2015-04-02 05:34:31,FALSE,NA,"583502752292081664",NA,"<a href=""http://my.kompas.com"" rel=""nofollow"">MyKompas</a>","kompascom",16,FALSE,FALSE,NA,NA
"286","Dirjen Kemendagri ""Skak Mat"" Ahok http://t.co/X0FiOErTGR",FALSE,11,NA,2015-04-02 05:32:28,FALSE,NA,"583502236950474752",NA,"<a href=""http://my.kompas.com"" rel=""nofollow"">MyKompas</a>","kompascom",6,FALSE,FALSE,NA,NA
"287","Luhut: Saya Tahu Rambu-rambu Permainan http://t.co/xKEIxNWGG6",FALSE,7,NA,2015-04-02 05:30:41,FALSE,NA,"583501784917807104",NA,"<a href=""http://my.kompas.com"" rel=""nofollow"">MyKompas</a>","kompascom",3,FALSE,FALSE,NA,NA
"288","Sejuknya Air Terjun Sipiso-Piso  http://t.co/l9sRnMJ4u6.",FALSE,1,NA,2015-04-02 05:30:30,FALSE,NA,"583501741133406208",NA,"<a href=""http://my.kompas.com"" rel=""nofollow"">MyKompas</a>","kompascom",6,FALSE,FALSE,NA,NA
"289","IHSG Sesi I Ditutup Melemah 5,17 Poin akibat Aksi Ambil Untung  http://t.co/uGJh8kaVDM",FALSE,2,NA,2015-04-02 05:28:47,FALSE,NA,"583501308465811456",NA,"<a href=""http://my.kompas.com"" rel=""nofollow"">MyKompas</a>","kompascom",3,FALSE,FALSE,NA,NA
"290","DPRD DKI Terima Undangan Kemendagri Mendadak http://t.co/VYDHS6Tv9h",FALSE,0,NA,2015-04-02 05:28:37,FALSE,NA,"583501264706633728",NA,"<a href=""http://my.kompas.com"" rel=""nofollow"">MyKompas</a>","kompascom",4,FALSE,FALSE,NA,NA
"291","Lufthansa Tahu Kopilot Depresi 6 Tahun Lalu http://t.co/z78iJOiqiD",FALSE,1,NA,2015-04-02 05:26:27,FALSE,NA,"583500720122404866",NA,"<a href=""http://my.kompas.com"" rel=""nofollow"">MyKompas</a>","kompascom",4,FALSE,FALSE,NA,NA
"292","""Lihat Tuh Wajah Pejabat Lesu, Kebayang Gaji Rp 75 Juta tapi Gak Jadi"" http://t.co/kg0FzEbxWx",FALSE,8,NA,2015-04-02 05:24:26,FALSE,NA,"583500213739892736",NA,"<a href=""http://my.kompas.com"" rel=""nofollow"">MyKompas</a>","kompascom",19,FALSE,FALSE,NA,NA
"293","Mengapa M Taufik, Lulung, dan Ferrial Tidak Hadir di Kemendagri? http://t.co/O7CXXFV2Y3",FALSE,2,NA,2015-04-02 05:18:23,FALSE,NA,"583498691157237761",NA,"<a href=""http://my.kompas.com"" rel=""nofollow"">MyKompas</a>","kompascom",7,FALSE,FALSE,NA,NA
"294","Aman... Stok Pupuk Bersubsidi untuk Tanam April!  http://t.co/EiZzWvpD4J",FALSE,2,NA,2015-04-02 05:14:20,FALSE,NA,"583497671245045760",NA,"<a href=""http://my.kompas.com"" rel=""nofollow"">MyKompas</a>","kompascom",6,FALSE,FALSE,NA,NA
"295","Raker bersama DPR, Wakapolri Diminta Tindak Lanjuti Laporan Golkar Kubu Aburizal http://t.co/vGh1nJGL8t",FALSE,0,NA,2015-04-02 05:12:21,FALSE,NA,"583497171841888256",NA,"<a href=""http://my.kompas.com"" rel=""nofollow"">MyKompas</a>","kompascom",3,FALSE,FALSE,NA,NA
"296","Apple Terima Tukar Tambah BlackBerry, Android, dan Windows Phone http://t.co/hPy0WdIeOz http://t.co/cmQQOx5yXP",FALSE,13,NA,2015-04-02 05:11:02,FALSE,NA,"583496839745277952",NA,"<a href=""http://www.socialbakers.com"" rel=""nofollow"">Socialbakers Builder</a>","kompascom",33,FALSE,FALSE,NA,NA
"297","Faisal Basri: Wapres ""Ngomong"" Beda, Presiden ""Ngomong"" Beda http://t.co/r5n5lUMhNG",FALSE,4,NA,2015-04-02 05:11:00,FALSE,NA,"583496832715628544",NA,"<a href=""http://www.socialbakers.com"" rel=""nofollow"">Socialbakers Builder</a>","kompascom",16,FALSE,FALSE,NA,NA
"298","Naik Lagi, Harga Elpiji 12 Kg Jadi Rp 142.000 per Tabung http://t.co/MpzugHead4 http://t.co/ipSRXvpJxf",FALSE,20,NA,2015-04-02 05:01:01,FALSE,NA,"583494319950073857",NA,"<a href=""http://www.socialbakers.com"" rel=""nofollow"">Socialbakers Builder</a>","kompascom",38,FALSE,FALSE,NA,NA
"299","Personel Brimob Tangkal Radikalisme dengan Ceramah di Pesantren http://t.co/xAweHwVJzt",FALSE,2,NA,2015-04-02 05:00:35,FALSE,NA,"583494212651352064",NA,"<a href=""http://my.kompas.com"" rel=""nofollow"">MyKompas</a>","kompascom",2,FALSE,FALSE,NA,NA
"300","Ketika Djokovic Disebut sebagai Pemain Veteran http://t.co/ko1xi9fqbk",FALSE,1,NA,2015-04-02 04:58:25,FALSE,NA,"583493667047911427",NA,"<a href=""http://my.kompas.com"" rel=""nofollow"">MyKompas</a>","kompascom",3,FALSE,FALSE,NA,NA
"301","Google Perkenalkan Chromebit, Komputer Sebesar Flashdisk http://t.co/n4p0wjASl6",FALSE,4,NA,2015-04-02 04:58:15,FALSE,NA,"583493622298873856",NA,"<a href=""http://my.kompas.com"" rel=""nofollow"">MyKompas</a>","kompascom",11,FALSE,FALSE,NA,NA
"302","Menko Polhukam: Latihan TNI di Poso Sekaligus untuk Menangkap Santoso http://t.co/T7eK1Hvrq6",FALSE,4,NA,2015-04-02 04:56:11,FALSE,NA,"583493105690607616",NA,"<a href=""http://my.kompas.com"" rel=""nofollow"">MyKompas</a>","kompascom",11,FALSE,FALSE,NA,NA
"303","Kursi DPRD DKI yang Kosong dan Gelisahnya Bestari Barus http://t.co/fhAoMZxSZb",FALSE,1,NA,2015-04-02 04:48:06,FALSE,NA,"583491069104427008",NA,"<a href=""http://my.kompas.com"" rel=""nofollow"">MyKompas</a>","kompascom",4,FALSE,FALSE,NA,NA
"304","Menkeu Mengaku Tak Tahu soal Kenaikan Uang Muka Mobil Pejabat http://t.co/PkWQczzFbF",FALSE,3,NA,2015-04-02 04:46:30,FALSE,NA,"583490668061855744",NA,"<a href=""http://my.kompas.com"" rel=""nofollow"">MyKompas</a>","kompascom",15,FALSE,FALSE,NA,NA
"305","Rapat Sambil Berdiri, Wapres Ambil Putusan Soal Cilamaya di Kantor Desa  http://t.co/nBZ9vX702H",FALSE,3,NA,2015-04-02 04:46:20,FALSE,NA,"583490624298418176",NA,"<a href=""http://my.kompas.com"" rel=""nofollow"">MyKompas</a>","kompascom",10,FALSE,FALSE,NA,NA
"306","Aktivis: Bareskrim Lamban Memanggil Menteri Tedjo, Ada Apa? http://t.co/8z7zJbGGpa",FALSE,2,NA,2015-04-02 04:46:09,FALSE,NA,"583490580556054528",NA,"<a href=""http://my.kompas.com"" rel=""nofollow"">MyKompas</a>","kompascom",5,FALSE,FALSE,NA,NA
"307","Remaja Mabuk Diselamatkan Setelah Lompat ke Kandang Singa http://t.co/q2FfhvBqpr",FALSE,1,NA,2015-04-02 04:44:13,FALSE,NA,"583490092229984256",NA,"<a href=""http://my.kompas.com"" rel=""nofollow"">MyKompas</a>","kompascom",12,FALSE,FALSE,NA,NA
"308","Tak Ada Lulung dan Taufik di Kemendagri http://t.co/4ksrRD1U9k",FALSE,3,NA,2015-04-02 04:42:06,FALSE,NA,"583489561314992128",NA,"<a href=""http://my.kompas.com"" rel=""nofollow"">MyKompas</a>","kompascom",5,FALSE,FALSE,NA,NA
"309","Hary Tanoe Akuisisi Bank Pundi http://t.co/1Z28fFXCVE",FALSE,6,NA,2015-04-02 04:38:10,FALSE,NA,"583488571517964288",NA,"<a href=""http://my.kompas.com"" rel=""nofollow"">MyKompas</a>","kompascom",16,FALSE,FALSE,NA,NA
